A966123E25,藤井　重広,,,,太陽光,35.4,滋賀県甲賀市土山町南土山字将軍地甲４７６,0,43.2,2月3日2017年,2019年1月,-,-,外部積立て,-,2038年11月
A966219E25,杉原　眞理子,,,,太陽光,22.0,滋賀県近江八幡市北津田町１０３８,0,28.6,2月3日2017年,2017年9月,-,-,外部積立て,-,2037年7月
A966240E25,滋賀建機株式会社,蔭山　明夫,愛知郡愛荘町中宿１６０－１,0749-42-8668,太陽光,49.5,滋賀県愛知郡愛荘町安孫子堂前３１６－１,1,72.8,2月3日2017年,2018年4月,-,-,外部積立て,-,2038年2月
A966245E25,齊藤　清吉,,,,太陽光,41.3,滋賀県高島市安曇川町四津川７４９,0,62.7,2月3日2017年,2017年7月,-,-,外部積立て,-,2037年5月
A966284E25,竜法師公民館,森川　憲一,甲賀市甲南町竜法師２６８５－２,0748-86-2370,太陽光,22.2,滋賀県甲賀市甲南町竜法師２６８５－２,0,23.9,2月3日2017年,2017年11月,-,-,外部積立て,-,2037年9月
A966285E25,城　建設,城　治美,東近江市小田苅町８７５－５,0749-45-0045,太陽光,49.5,滋賀県東近江市鯰江町１４４１－１,0,74.8,2月3日2017年,2017年9月,-,-,外部積立て,-,2037年7月
A966378E25,枡谷　文仁,,,,太陽光,38.5,滋賀県蒲生郡日野町村井字安村８２３－１,0,40.5,2月3日2017年,2018年7月,-,-,外部積立て,-,2038年5月
A966379E25,中江　恭一,,,,太陽光,49.5,滋賀県蒲生郡日野町音羽５３０－１,0,64.8,2月3日2017年,2017年7月,-,-,外部積立て,-,2037年6月
A966384E25,有限会社　東峰製作所,細江　英人,愛知郡愛荘町東円堂１２５２,0749-42-2772,太陽光,49.5,滋賀県愛知郡愛荘町東円堂１２５２,0,53.0,2月3日2017年,2017年6月,-,-,外部積立て,-,2037年5月
A966423E25,株式会社ジョイクライマー,高畑　一貴,滋賀県大津市大萱６－１－１,,太陽光,49.0,滋賀県大津市大萱６－３５００－５,0,49.5,2月3日2017年,2018年4月,-,-,外部積立て,-,2037年11月
A966427E25,桂田　敦司,,,,太陽光,30.8,滋賀県高島市安曇川町青柳８３０－２,1,30.8,2月3日2017年,2017年7月,-,-,外部積立て,-,2037年5月
A966465E25,折小野　恵子,,,,太陽光,49.5,滋賀県蒲生郡日野町北畑字牧野５５６,6,64.8,2月3日2017年,2017年11月,-,-,外部積立て,-,2037年9月
A966493E25,有限会社　染川工業所,染川　明嗣,犬上郡豊郷町八目９－２,0749-37-2657,太陽光,27.5,滋賀県愛知郡愛荘町島川字堀池１２７６－１,0,34.3,2月3日2017年,2017年6月,-,-,外部積立て,-,2037年4月
A966547E25,三軌工業株式会社,古川　哲也,米原市岩脇４８３,0749-52-4370,太陽光,41.3,滋賀県米原市岩脇４９７－１,0,58.5,2月3日2017年,2017年6月,-,-,外部積立て,-,2037年4月
A966563E25,有限会社明誠商事,土居　誠,滋賀県彦根市小泉町９１９,,太陽光,49.9,滋賀県彦根市八坂町１０８４,1,65.3,2月3日2017年,2017年8月,-,-,外部積立て,-,2037年5月
A966598E25,白井　千晶,,,,太陽光,49.5,滋賀県蒲生郡日野町西大路２５００－３,0,122.7,2月3日2017年,2018年9月,-,-,外部積立て,-,2038年7月
A966600E25,株式会社　成功産業,山野　浩子,彦根市野田山町８３３－２,0749-26-6216,太陽光,49.5,滋賀県彦根市野田山町８３３－２,0,49.5,2月3日2017年,2021年5月,-,-,外部積立て,-,2040年2月
A966631E25,中嶋　一成,,,,太陽光,29.7,滋賀県甲賀市水口町嶬峨１３６０－１,0,37.4,2月3日2017年,2017年7月,-,-,外部積立て,-,2037年6月
A966663E25,株式会社　Ｔ－ＫＥＮ,田中　健一,城陽市寺田新池１１－７,,太陽光,49.5,滋賀県甲賀市土山町大野字北谷３９４８－４７,0,49.5,2月3日2017年,2017年9月,-,-,外部積立て,-,2037年8月
A966707E25,株式会社　ヒョーシン,田中　伸一,長浜市南浜町７８５番地,0749-72-8055,太陽光,49.5,滋賀県長浜市湖北町小倉８９、９０、１０６、１０７、１０８、１０９、１１０、１１０－１、１１１－１（住居表示未確定）,0,71.2,2月3日2017年,2020年9月,-,-,外部積立て,-,2040年2月
A966718E25,有限会社　大橋電工,大橋　政善,東近江市南清水町４４０番地３,0749-45-1548,太陽光,41.3,滋賀県東近江市南清水町４４０－３,0,43.8,2月3日2017年,2018年9月,-,-,外部積立て,-,2038年6月
A966724E25,谷本　淳,,,,太陽光,23.6,滋賀県高島市今津町日置前字四ツ辻３８３－１１５,0,40.3,2月3日2017年,2017年5月,-,-,外部積立て,-,2037年4月
A966770E25,小森　勇,,,,太陽光,38.5,滋賀県甲賀市甲賀町大原上田字山ノ前１０７１,0,45.9,2月3日2017年,2021年1月,-,-,外部積立て,-,2040年2月
A966774E25,中井　陽子,,,,太陽光,37.0,滋賀県長浜市川崎町２１７,0,41.3,2月3日2017年,2017年8月,-,-,外部積立て,-,2037年5月
A966783E25,株式会社　松山組,松山　正彦,蒲生郡日野町音羽５３２,0748-53-3623,太陽光,49.5,滋賀県蒲生郡日野町音羽５６２,0,74.5,2月3日2017年,2021年11月,無,-,外部積立て,-,2040年2月
A966855E25,株式会社エムジーエネルギー,村田　充,滋賀県守山市播磨田町６３０,077-583-8072,太陽光,49.5,滋賀県東近江市芝原町字玉緒１４９５－９,0,72.9,2月3日2017年,2018年5月,-,-,外部積立て,-,2038年3月
A966868E25,中野　義孝,,,,太陽光,22.0,滋賀県東近江市石塔町字宮田４６７－４,0,35.3,2月3日2017年,2017年5月,-,-,外部積立て,-,2037年4月
A966902E25,株式会社　七福建設,山野　憲伺,彦根市野田山町８３３－１,0749-26-6166,太陽光,49.5,滋賀県愛知郡愛荘町東円堂５３４－２,0,54.0,2月3日2017年,2019年2月,-,-,外部積立て,-,2038年11月
A966966E25,久保　龍矢,,,,太陽光,49.5,滋賀県彦根市鳥居本町４７３,0,72.9,2月3日2017年,2019年8月,-,-,外部積立て,-,2039年7月
A966991E25,株式会社　ファインエナジー,吉田　真一,甲賀市甲南町野尻６５５,0748-86-2224,太陽光,49.5,滋賀県甲賀市土山町北土山３４７,0,88.2,2月3日2017年,2020年4月,-,-,外部積立て,-,2040年2月
A967009E25,西木　守,,,,太陽光,22.0,滋賀県守山市岡町１４３－１,0,22.5,2月3日2017年,2019年4月,-,-,外部積立て,-,2039年2月
A967093E25,株式会社　ＧＬＵＣＫ,内貴　浩二,草津市南笠東一丁目１５番５号,,太陽光,49.0,滋賀県蒲生郡竜王町山中字東谷田９２３－１７５,2,56.1,2月3日2017年,2017年7月,-,-,外部積立て,-,2037年5月
A967166E25,佐橋　浩市,,,,太陽光,40.5,滋賀県近江八幡市池田本町５５５,0,76.7,2月3日2017年,2019年4月,-,-,外部積立て,-,2039年2月
A967185E25,株式会社エムズ・システムサービス,代表取締役　三谷龍太,草津市南笠東一丁目１４－３６,077-563-2377,太陽光,49.0,滋賀県東近江市市ケ原町３１,0,70.4,2月3日2017年,2017年10月,-,-,外部積立て,-,2037年7月
A967193E25,株式会社森川ネクストエナジー,森川　融,徳島県小松島市中田町字浜田１－２,0885-32-1050,太陽光,500.0,滋賀県湖南市下田字雷古３０－２,7,636.0,2月2日2017年,2017年7月,-,-,外部積立て,-,2037年5月
A967196E25,愛知川沿岸土地改良区,小椋　正清,滋賀県東近江市春日町２－７,0748-22-1296,太陽光,1500.0,滋賀県東近江市尻無町字山ノ間２１６２,1,1621.7,2月2日2017年,2018年3月,-,-,外部積立て,-,2038年1月
A967771E25,有限会社　昭英工業,池田英夫,東近江市愛東外町１０９２番地,0749-46-1192,太陽光,49.5,滋賀県近江八幡市長光寺町８６８－２,0,49.5,2月7日2017年,2017年7月,-,-,外部積立て,-,2037年5月
A967785E25,奥居仏具株式会社,奥居　雅彦,彦根市川瀬馬場町１０７１,0749-28-2501,太陽光,49.5,滋賀県彦根市川瀬馬場町１０７１,0,49.5,2月7日2017年,2017年10月,-,-,外部積立て,-,2037年8月
A967816E25,奥村　康則,,,,太陽光,49.5,滋賀県近江八幡市長光寺町８６８－７,0,49.5,2月7日2017年,2017年7月,-,-,外部積立て,-,2037年5月
A967817E25,株式会社　青山製作所,青山　滋,東近江市愛東外町５８２,0749-46-1186,太陽光,49.5,滋賀県近江八幡市長光寺町８６８－６,0,49.5,2月7日2017年,2017年7月,-,-,外部積立て,-,2037年5月
A967846E25,合同会社ニシムラ,代表社員　西村　忠朋,彦根市中藪町７２１－４,0749-27-4787,太陽光,100.0,滋賀県彦根市八坂町字上杭２－１,0,130.5,2月9日2017年,2018年3月,-,-,外部積立て,-,2038年1月
A968747E25,米原　充紘,,,,太陽光,49.5,滋賀県蒲生郡日野町中山字徳原７４７－３４０,0,49.5,2月9日2017年,2017年5月,-,-,外部積立て,-,2037年4月
A969104E25,吉野　友康,,,,太陽光,27.5,滋賀県高島市新旭町針江字川北１４３２－１５７（住居表示未確定）,0,27.5,2月14日2017年,2017年12月,-,-,外部積立て,-,2037年9月
A969109E25,羽賀　瑠美,,,,太陽光,49.5,滋賀県蒲生郡日野町河原６０２,0,82.0,2月14日2017年,2020年3月,-,-,外部積立て,-,2040年1月
A969119E25,大島　友基,,,,太陽光,49.5,滋賀県蒲生郡日野町河原字五斗井５９８,0,79.6,2月14日2017年,2019年9月,-,-,外部積立て,-,2039年7月
A969125E25,株式会社　マル若商店,若尾　圓三郎,岐阜県多治見市小名田町３－１５２,0572-22-0639,太陽光,49.5,滋賀県大津市南比良字天神山１０９０,0,82.0,2月14日2017年,2018年6月,-,-,外部積立て,-,2038年4月
A969127E25,柴垣　光晴,,,,太陽光,26.4,滋賀県高島市マキノ町新保平戸谷１３１４－１０,0,38.7,2月14日2017年,2017年8月,-,-,外部積立て,-,2037年6月
A969128E25,笠井　亜衣理,,,,太陽光,49.5,滋賀県大津市穴太３－２９８－３,0,49.5,2月14日2017年,2017年9月,-,-,外部積立て,-,2037年7月
A969129E25,株式会社ＴＲＮ,辻　明,大阪府大阪市北区豊崎２－５－１５,072-654-1740,太陽光,49.5,滋賀県甲賀市水口町山字栗の木谷３４５９－３４６,0,64.8,2月14日2017年,2017年8月,-,-,外部積立て,-,2037年6月
A969130E25,株式会社辻不動産,辻　明,大阪府摂津市鳥飼下２－２－７－３Ｆ,072-654-1740,太陽光,49.5,滋賀県甲賀市水口町山字栗の木谷３４５９－３４８,0,64.8,2月14日2017年,2017年8月,-,-,外部積立て,-,2037年7月
A969131E25,山本　定徳,,,,太陽光,49.5,滋賀県彦根市鳥居本町字下芹原５７６,1,79.6,2月14日2017年,2017年10月,-,-,外部積立て,-,2037年9月
A969132E25,合同会社いだてん,天満隆二,岡山県岡山市北区法界院７番５２－５号,,太陽光,49.5,滋賀県彦根市鳥居本町字下芹原５７９,0,79.6,2月14日2017年,2019年10月,-,-,外部積立て,-,2039年8月
A969133E25,吉形　圭右,,,,太陽光,49.5,滋賀県彦根市鳥居本町字下芹原５７２,0,79.6,2月14日2017年,2018年2月,-,-,外部積立て,-,2037年11月
A969134E25,湖南開発有限会社,藤井　崇夫,滋賀県守山市小島町１５７７番地,077-583-1116,太陽光,49.5,滋賀県彦根市鳥居本町字下芹原５８０－２,0,68.2,2月14日2017年,2018年4月,-,-,外部積立て,-,2037年11月
A969135E25,湖南開発有限会社,藤井　崇夫,滋賀県守山市小島町１５７７番地,077-583-1116,太陽光,49.5,滋賀県彦根市鳥居本町字下芹原５７３,0,79.6,2月14日2017年,2018年2月,-,-,外部積立て,-,2037年12月
A969136E25,村木　亮介,,,,太陽光,49.5,滋賀県彦根市鳥居本町字下芹原５７１,0,79.6,2月14日2017年,2018年2月,-,-,外部積立て,-,2037年12月
A969137E25,草野　裕昭,,,,太陽光,49.5,滋賀県彦根市鳥居本町字下芹原５８０－１,0,79.6,2月14日2017年,2018年2月,-,-,外部積立て,-,2037年12月
A969138E25,湖南開発有限会社,藤井　崇夫,滋賀県守山市小島町１５７７番地,077-583-1116,太陽光,49.5,滋賀県彦根市鳥居本町字下芹原５６９,0,79.6,2月14日2017年,2018年3月,-,-,外部積立て,-,2037年11月
A969139E25,㔟簱　大志,,,,太陽光,49.5,滋賀県彦根市鳥居本町字下芹原５７０,0,79.6,2月14日2017年,2018年1月,-,-,外部積立て,-,2037年11月
A969140E25,加藤　和宏,,,,太陽光,49.5,滋賀県彦根市鳥居本町字下芹原５６４－２,0,79.6,2月14日2017年,2018年4月,-,-,外部積立て,-,2038年2月
A969141E25,草野　裕昭,,,,太陽光,49.5,滋賀県彦根市鳥居本町字下芹原５６７-１,0,79.6,2月14日2017年,2018年4月,-,-,外部積立て,-,2038年2月
A969142E25,原田　公寿,,,,太陽光,49.5,滋賀県彦根市鳥居本町字下芹原５６６,0,79.6,2月14日2017年,2018年4月,-,-,外部積立て,-,2038年2月
A969143E25,合同会社プロフィット,池田一三,大阪府藤井寺市沢田４－２－４０,072-953-5000,太陽光,49.5,滋賀県彦根市鳥居本町字下芹原５６８－１,0,79.6,2月14日2017年,2018年4月,-,-,外部積立て,-,2038年2月
A969148E25,大田　康子,,,,太陽光,22.0,滋賀県高島市マキノ町新保平戸谷１３１４－１３,0,36.4,2月14日2017年,2017年8月,-,-,外部積立て,-,2037年6月
A969216E25,中堀　佐一郎,,,,太陽光,49.9,滋賀県大津市木戸字小村田１８２７－１,1,70.2,2月14日2017年,2017年10月,-,-,外部積立て,-,2037年8月
A969224E25,富田　恒和,,,,太陽光,22.0,滋賀県東近江市東沖野１－２－２６,0,28.6,2月14日2017年,2017年7月,-,-,外部積立て,-,2037年5月
A969233E25,株式会社アーネストライフ,山口俊和,大津市一里山１丁目２－１１,077-544-4468,太陽光,22.0,滋賀県大津市大萱１－４－１５,0,23.4,2月14日2017年,2017年5月,-,-,外部積立て,-,2037年3月
A969238E25,小倉　友和,,,,太陽光,49.5,滋賀県甲賀市甲賀町大原中３０３－１,2,64.8,2月14日2017年,2018年5月,-,-,外部積立て,-,2038年3月
A969245E25,有限会社　東伸,松原　洋平,名古屋市北区大曽根１－１９－１６ザ・パークハウス大曽根１４０２号,052-910-3071,太陽光,49.5,滋賀県蒲生郡日野町河原６００,0,82.0,2月14日2017年,2020年3月,-,-,外部積立て,-,2040年1月
A969266E25,株式会社　タナカ重建,田中　康博,近江八幡市白鳥町１９－３,0748-36-0687,太陽光,49.5,滋賀県近江八幡市安土町上出９９２－２４,0,74.7,2月14日2017年,2018年7月,-,-,外部積立て,-,2038年5月
A969268E25,西村　洋平,,,,太陽光,49.5,滋賀県彦根市鳥居本町５４８,1,82.0,2月14日2017年,2019年8月,-,-,外部積立て,-,2039年7月
A969295E25,有限会社システムユニット商事,窪田　知巳,岡山県岡山市南区福富中１－９－１２－３０４,086-265-9234,太陽光,49.5,滋賀県高島市朽木野尻字野街道４７８－７,0,65.5,2月14日2017年,2020年4月,-,-,外部積立て,-,2040年2月
A969325E25,梅田　朋江,,,,太陽光,49.5,滋賀県蒲生郡日野町音羽６２４－１,2,64.8,2月14日2017年,2017年11月,-,-,外部積立て,-,2037年10月
A969334E25,岡　良子,,,,太陽光,49.5,滋賀県長浜市木之本町千田２３６,0,85.8,2月14日2017年,2017年6月,-,-,外部積立て,-,2037年4月
A969360E25,株式会社　Ｄ’ｓ　Ｌｉｆｅ,早瀬　大樹,犬上郡甲良町池寺１１４４－１,0749-38-8139,太陽光,49.5,滋賀県犬上郡甲良町大字池寺字上横畔１１４４－１,0,68.2,2月14日2017年,2017年6月,-,-,外部積立て,-,2037年5月
A969383E25,西山　彰,,,,太陽光,49.5,滋賀県愛知郡愛荘町常安寺４７５‐１,0,49.5,2月14日2017年,2017年8月,-,-,外部積立て,-,2037年6月
A969387E25,金城開発株式会社,北川　光明,滋賀県彦根市古沢町６８５番地,0749-23-3331,太陽光,44.0,滋賀県高島市マキノ町中庄字宮崎１２２０－１,0,77.0,2月14日2017年,2018年4月,-,-,外部積立て,-,2038年3月
A969402E25,株式会社尾賀亀,尾賀康裕,近江八幡市出町２９３,0748-33-3108,太陽光,29.7,滋賀県近江八幡市出町２９３,0,37.8,2月14日2017年,2017年6月,-,-,外部積立て,-,2037年5月
A969431E25,川嵜　晴之,,,,太陽光,33.0,滋賀県東近江市山上町３１２１,0,46.8,2月14日2017年,2017年8月,-,-,外部積立て,-,2037年6月
A969432E25,枡谷　文仁,,,,太陽光,33.0,滋賀県甲賀市甲賀町大原上田字北垣外１４６３,0,37.2,2月14日2017年,2019年7月,-,-,外部積立て,-,2039年5月
A969437E25,向内　健二,,,,太陽光,49.5,滋賀県蒲生郡日野町村井廐上１１４１－１,2,88.5,2月14日2017年,2018年3月,-,-,外部積立て,-,2038年1月
A969439E25,安田　朋,,,,太陽光,49.5,滋賀県甲賀市甲賀町高野字細田９０７,0,58.3,2月14日2017年,2018年11月,-,-,外部積立て,-,2038年9月
A969444E25,有限会社米定,川島　徹也,東近江市猪子町３８２－５,0748-42-0025,太陽光,28.6,滋賀県東近江市猪子町３８２－５,0,34.6,2月14日2017年,2018年12月,-,-,外部積立て,-,2038年10月
A969465E25,株式会社Ｐｕｒｉｓｍ,山元　純次,滋賀県栗東市安養寺７９８－１４,077-554-2251,太陽光,37.0,滋賀県栗東市荒張１１０３－６７,1,47.2,2月14日2017年,2017年7月,-,-,外部積立て,-,2037年5月
A969482E25,有限会社　鯉口建設,鯉口　直行,彦根市下岡部町６２０,0749-43-2082,太陽光,49.5,滋賀県彦根市上岡部町４８８－３,5,66.6,2月14日2017年,2021年8月,-,-,外部積立て,-,2040年2月
A969522E25,隂山　貴之,,,,太陽光,49.5,滋賀県高島市朽木荒川字惣田１４２,0,102.0,2月14日2017年,2018年10月,-,-,外部積立て,-,2038年8月
A969533E25,福井　一晴,,,,太陽光,49.5,滋賀県甲賀市甲賀町大原中３０１,2,64.8,2月14日2017年,2018年5月,-,-,外部積立て,-,2038年3月
A969551E25,株式会社トキワ・ホーム,堀　常一,犬上郡豊郷町安食南３５０－１１,0749-35-4357,太陽光,49.5,滋賀県犬上郡豊郷町下枝７９－１,1,79.5,2月14日2017年,2017年8月,-,-,外部積立て,-,2037年7月
A969599E25,平田　京子,,,,太陽光,49.5,滋賀県彦根市中藪１－８８,0,57.3,2月14日2017年,2017年7月,-,-,外部積立て,-,2037年4月
A969614E25,有限会社プラグレス,松本　由美子,滋賀県甲賀市水口町泉３５２－７,0748-63-7275,太陽光,49.5,滋賀県甲賀市甲南町深川字長坂３６７－１２,7,91.0,2月14日2017年,2018年4月,-,-,外部積立て,-,2038年2月
A969643E25,ギャラクシーソーラー合同会社,ギャラクシーソーラーホールディングス一般社団法人　職務執行者　出澤　貴人,東京都中央区八丁堀４－２－１０ＡＯＪ税理士法人内,,太陽光,49.5,滋賀県大津市大物字大野７６８－１,0,98.2,2月14日2017年,2019年7月,-,-,外部積立て,-,2039年5月
A969710E25,吉田電工株式会社,吉田　正和,甲賀市甲南町野尻６５５,0748-86-2224,太陽光,39.6,滋賀県甲賀市甲賀町和田字門田２８１－２,1,46.9,2月15日2017年,2020年4月,-,-,外部積立て,-,2040年2月
A969711E25,吉田電工株式会社,吉田　正和,甲賀市甲南町野尻６５５,0748-86-2224,太陽光,39.6,滋賀県甲賀市甲賀町和田字門田２７９－３,4,54.0,2月15日2017年,2018年7月,-,-,外部積立て,-,2038年5月
A969898E25,株式会社ＲＥＴＲＹ,森下　悦道,目黒区青葉台３－１－２１　渋谷ＷＥＳＴ１５０１,03-5784-3420,太陽光,49.5,滋賀県高島市朽木古川字北出平２３６－１,0,98.0,2月15日2017年,2020年4月,-,-,外部積立て,-,2039年12月
A971523E25,株式会社　大島組,大島　孝美,蒲生郡日野町村井３－１２,0748-52-1640,太陽光,49.5,滋賀県蒲生郡日野町村井３－１,0,74.8,2月20日2017年,2017年8月,-,-,外部積立て,-,2037年6月
A971549E25,株式会社尾賀亀,尾賀康裕,近江八幡市出町２９３,0748-33-3108,太陽光,29.7,滋賀県東近江市五智町奥野３１５,0,38.3,2月20日2017年,2017年7月,-,-,外部積立て,-,2037年5月
A971554E25,城　泰弘,,,,太陽光,22.0,滋賀県東近江市鯰江町１４４２－１,0,24.9,2月20日2017年,2017年8月,-,-,外部積立て,-,2037年5月
A971607E25,フローネスト株式会社,矢田　勉,大阪府枚方市香里園町２７－１０,06-6353-6077,太陽光,49.5,滋賀県甲賀市甲賀町隠岐字大谷２３８６,0,72.0,2月22日2017年,2021年11月,-,-,外部積立て,-,2040年7月
A971608E25,株式会社プラスアルファ,祐谷　英輝,大阪府松原市天美我堂２－３７７－６,,太陽光,49.5,滋賀県甲賀市甲賀町隠岐字大谷２３８５－１０,0,72.0,2月22日2017年,2021年11月,-,-,外部積立て,-,2040年7月
A971614E25,廣瀬　健一,,,,太陽光,49.5,滋賀県大津市石山南郷町字上山４７９－５３,2,58.3,2月22日2017年,2017年8月,-,-,外部積立て,-,2037年6月
A971678E25,株式会社藤田電気工業,代表取締役　藤田　善志良,東近江市小倉町１９３２,0749-46-1169,太陽光,499.5,滋賀県東近江市小倉町字向田井２４４１－１,3,671.1,3月2日2017年,2020年6月,-,-,外部積立て,-,2040年5月
A971702E25,株式会社ＥＬＩＸＩＲ,奥野　寛,京都府京都市右京区西院平町７,077-531-2770,太陽光,38.5,滋賀県湖南市正福寺字榎８１－１,0,38.5,3月1日2017年,2017年8月,-,-,外部積立て,-,2037年6月
A971703E25,株式会社コスモメンテナンス,奥野　寛,京都府京都市下京区綾小路通麩屋町西入塩屋町８０,077-531-2770,太陽光,44.0,滋賀県湖南市正福寺字榎８１－４,0,44.0,3月1日2017年,2017年8月,-,-,外部積立て,-,2037年6月
A971808E25,コトブキ株式会社,堀田　隆,滋賀県米原市枝折２９４,0749-54-2307,太陽光,1980.0,滋賀県米原市枝折字平内２９４　他（別紙のとおり）,0,2337.4,3月2日2017年,2022年3月,-,-,外部積立て,-,2040年6月
A971844E25,本郷　智也,,,,太陽光,49.0,滋賀県甲賀市甲南町市原５１５,7,77.5,3月3日2017年,2017年9月,-,-,外部積立て,-,2037年6月
A971910E25,姫路港木材株式会社,岸本　隆明,兵庫県姫路市網干区垣内東町１５４,079-274-7061,太陽光,170.0,滋賀県高島市マキノ町西浜字高畑ケ９１５－１,0,201.9,3月9日2017年,2020年3月,-,-,外部積立て,-,2040年2月
A971927E25,朝比奈　健司,,,,太陽光,49.5,滋賀県甲賀市土山町大河原１７３０,0,68.2,3月7日2017年,2017年9月,-,-,外部積立て,-,2037年7月
A971961E25,田中　雅人,,,,太陽光,49.5,滋賀県甲賀市土山町大河原字杉谷１７２６－１３,0,68.2,3月7日2017年,2017年9月,-,-,外部積立て,-,2037年7月
A971968E25,大津紙業写真印刷株式会社,代表取締役　堀口正徳,大津市月輪一丁目字烏子１０３番地１１,077-544-0190,太陽光,49.0,滋賀県大津市月輪一丁目字烏子１０３－１１,0,76.7,3月7日2017年,2017年7月,-,-,外部積立て,-,2037年5月
A971991E25,一般社団法人　日本アースマイル,代表理事　本郷智也,草津市野路東６丁目３番４号　ブレジオ３ー７０７,,太陽光,49.0,滋賀県甲賀市土山町大河原１７２６－１５,0,79.2,3月7日2017年,2017年10月,-,-,外部積立て,-,2037年8月
A971992E25,本郷　智也,,,,太陽光,49.0,滋賀県甲賀市土山町大河原１７２６－１６,0,79.2,3月7日2017年,2018年12月,-,-,外部積立て,-,2038年7月
A971993E25,山内　正,,,,太陽光,49.0,滋賀県甲賀市土山町大河原１７２６－１４,0,79.2,3月7日2017年,2018年3月,無,無,外部積立て,-,2037年12月
A972015E25,小森　勇,,,,太陽光,47.2,滋賀県蒲生郡日野町北畑字牧野５４６－２,0,64.8,3月7日2017年,2017年9月,-,-,外部積立て,-,2037年8月
A972079E25,株式会社エムズ・システムサービス,代表取締役　三谷龍太,草津市南笠東一丁目１４－３６,077-563-2377,太陽光,49.0,滋賀県東近江市市ケ原町３７,0,70.4,3月7日2017年,2017年10月,-,-,外部積立て,-,2037年7月
A972086E25,佐橋　浩市,,,,太陽光,49.5,滋賀県湖南市北山台３－３－１４,0,74.5,3月7日2017年,2020年1月,-,-,外部積立て,-,2039年11月
A972087E25,株式会社Ｓ．Ｐ．Ｇ．Ｙ,山脇　秀介,滋賀県彦根市小泉町３００番地９,0749-22-3228,太陽光,49.5,滋賀県甲賀市甲南町市原字前野５５９,0,87.0,3月7日2017年,2018年7月,-,-,外部積立て,-,2038年5月
A972088E25,菊地　宏,,,,太陽光,49.5,滋賀県甲賀市甲南町市原５６０－１,2,57.9,3月7日2017年,2018年1月,-,-,外部積立て,-,2037年12月
A972090E25,小川　浩司郎,,,,太陽光,49.5,滋賀県高島市安曇川町上古賀西片屋２０７７－１,0,74.8,3月7日2017年,2018年4月,-,-,外部積立て,-,2038年2月
A972095E25,岡谷　祐一郎,,,,太陽光,49.5,滋賀県甲賀市甲南町市原字前野５６３－１,0,88.5,3月7日2017年,2019年4月,-,-,外部積立て,-,2039年2月
A972116E25,桝田　渉,,,,太陽光,23.6,滋賀県蒲生郡日野町小谷字表５９２－２,1,30.6,3月7日2017年,2018年5月,-,-,外部積立て,-,2038年4月
A972123E25,川口　力也,,,,太陽光,49.5,滋賀県甲賀市土山町北土山和草野２８０８,0,71.6,3月7日2017年,2019年6月,-,-,外部積立て,-,2039年5月
