A866960E25,株式会社エフワン,神田　進,滋賀県大津市和邇北浜４０５,077-594-4444,太陽光,27.0,滋賀県蒲生郡日野町仁本木７３０－１６,0,27.0,11月10日2014年,2015年4月,-,-,外部積立て,-,2035年2月
A866977E25,岩上産業株式会社,村上　義彦,甲賀市水口町今郷４８３－２,0748-62-1575,太陽光,25.0,滋賀県甲賀市水口町今郷４８３－２,0,30.0,11月10日2014年,2015年4月,-,-,外部積立て,-,2035年2月
A866995E25,株式会社　スポーツショップキムラ,木村　守,彦根市彦富町９１３－１,0749-43-5918,太陽光,49.5,滋賀県犬上郡豊郷町安食南４７１－１,0,63.7,11月10日2014年,2016年6月,-,-,外部積立て,-,2036年3月
A866997E25,中川　艶子,,,,太陽光,44.0,滋賀県彦根市彦富町１３６９－１,0,45.6,11月10日2014年,2015年4月,-,-,外部積立て,-,2035年2月
A867986E25,合同会社グリーンパートナー,入倉　栄作,岡山県岡山市東区神崎町１８３０－１,086-943-6655,太陽光,250.0,滋賀県高島市マキノ町森西字黒川５９１－４,0,269.2,11月20日2014年,2015年8月,-,-,外部積立て,-,2035年6月
A867990E25,滋賀建機株式会社,蔭山　明夫,愛知郡愛荘町中宿１６０－１,0749-42-8668,太陽光,211.5,滋賀県犬上郡豊郷町大字八町字登り地７９６,4,211.5,11月27日2014年,2015年5月,-,-,外部積立て,-,2035年4月
A867992E25,美松不動産株式会社,平松　善雄,滋賀県湖南市平松北２－１,0748-72-3240,太陽光,200.0,滋賀県栗東市荒張字エチ７５２－１,1,226.8,11月27日2014年,2017年8月,-,-,外部積立て,-,2037年6月
A867994E25,滋賀小林精工株式会社,小林　和夫,野洲市大篠原２０２６,077-587-0219,太陽光,200.0,滋賀県野洲市大篠原字野神２０２６,0,200.0,11月27日2014年,2015年3月,-,-,外部積立て,-,2035年2月
A867998E25,北村　大輔,,,,太陽光,200.0,滋賀県彦根市宮田町字次良谷４６３,1,200.0,11月27日2014年,2015年7月,-,-,外部積立て,-,2035年5月
A867999E25,マコト建設株式会社,石原　信夫,守山市守山町１５１－１,077-583-5788,太陽光,250.0,滋賀県近江八幡市末広町字流３９６,9,285.6,11月27日2014年,2015年4月,-,-,外部積立て,-,2035年2月
A868015E25,森田ビル通商株式会社,森田　昌司,大津市京町３－４－３２,077-526-1000,太陽光,225.0,滋賀県高島市今津町深清水字浜崎１６－５,2,264.0,11月27日2014年,2015年5月,-,-,外部積立て,-,2035年3月
A868021E25,合同会社日出アグリ,岩村　英満,京都市下京区西七条東御前田町４８,075-312-1426,太陽光,148.4,滋賀県高島市鴨字塚町９９１－１,5,160.1,12月4日2014年,2015年4月,-,-,外部積立て,-,2035年2月
A868022E25,株式会社ライフィット,松田　有司,京都市北区小山北上総町４,077-562-7554,太陽光,247.6,滋賀県高島市新旭町新庄字川原神１４０４－１,5,247.6,12月4日2014年,2015年9月,-,-,外部積立て,-,2035年7月
A868023E25,山本　春幸,,,,太陽光,120.0,滋賀県近江八幡市野村町字奥山１２２７－１,0,122.9,12月4日2014年,2015年12月,-,-,外部積立て,-,2035年11月
A868030E25,吉岡ウェビング株式会社,吉岡　芳人,東近江市勝堂町３６０,0749-45-2006,太陽光,500.0,滋賀県彦根市松原町字矢倉３１８８－３,8,571.3,12月4日2014年,2015年5月,-,-,外部積立て,-,2035年3月
A868037E25,有限会社Ｔａｎｉｇｕｃｈｉ　Ｄｒｅａｍ　Ｐｌａｎｎｉｎｇ,代表取締役　谷口　伸太郎,大津市衣川１－３３－４０,077-571-3020,太陽光,361.0,滋賀県甲賀市土山町大野字土々ケ谷４８０４,5,361.0,12月4日2014年,2015年8月,-,-,外部積立て,-,2035年6月
A868048E25,株式会社ＧＯ－ＥＮ,代表取締役　藤田　映理子,大津市青山２－１２－９,077-549-3888,太陽光,325.0,滋賀県蒲生郡竜王町大字薬師字砂山１１７８－１７,0,363.1,12月4日2014年,2015年12月,-,-,外部積立て,-,2035年11月
A868057E25,社会福祉法人信楽福祉会,岩永　峯一,甲賀市信楽町牧１１５９,0748-83-1313,太陽光,330.0,滋賀県甲賀市水口町山字柳谷３３０９,9,340.5,12月11日2014年,2015年11月,-,-,外部積立て,-,2035年10月
A868061E25,那須　賢司,,,,太陽光,212.1,滋賀県彦根市後三条町字宮立１１０－１,2,212.1,12月11日2014年,2015年5月,-,-,外部積立て,-,2035年3月
A868065E25,東澤自動車工業株式会社,東澤　芳光,甲賀市水口町泉３２８－３,0748-63-0860,太陽光,420.0,滋賀県甲賀市水口町山字向出２５５２－１,0,420.0,12月11日2014年,2017年4月,-,-,外部積立て,-,2037年2月
A868091E25,滋賀建機株式会社,代表取締役社長　蔭山　明夫,愛知郡愛荘町中宿１６０－１,0749-42-8668,太陽光,931.7,滋賀県愛知郡愛荘町目加田字神坊１９８０－１,6,931.7,12月18日2014年,2016年10月,-,-,外部積立て,-,2036年8月
A868097E25,湖東興産株式会社,今若　伸男,東近江市上中野町９５６,0749-46-1570,太陽光,819.0,滋賀県東近江市山上町字馬ノ頭４１０８,7,819.0,12月18日2014年,2016年4月,-,-,外部積立て,-,2036年2月
A868100E25,吉岡ウェビング株式会社,代表取締役社長　吉岡　芳人,東近江市勝堂町３６０,0749-45-2006,太陽光,500.0,滋賀県蒲生郡竜王町大字山中字長谷２８１－３,3,562.9,12月18日2014年,2017年2月,-,-,外部積立て,-,2036年12月
A868103E25,株式会社春日ゴルフ,代表取締役　惣司　寛子,甲賀市水口町春日１４６,0748-65-2552,太陽光,1018.5,滋賀県甲賀市水口町春日字坂ノ橋１４６　他（別紙のとおり）,0,1018.5,12月18日2014年,2015年12月,-,-,外部積立て,-,2035年10月
A868109E25,湖北総合開発株式会社,植田　薫,彦根市甲田町５５５,0749-23-8333,太陽光,148.5,滋賀県長浜市西上坂町字田倉１１６７,3,148.5,12月18日2014年,2015年7月,-,-,外部積立て,-,2035年5月
A868110E25,湖東農業協同組合,野田　敬治,東近江市池庄町５０７,0749-45-0551,太陽光,118.8,滋賀県東近江市妹町字柿立１６９,0,118.8,12月18日2014年,2015年5月,-,-,外部積立て,-,2035年3月
A868113E25,ダイイチファイナンシャルグループ住宅販売有限会社,代表取締役　米花　和幸,川西市小花１－２１－１４ＬＯＨＡＵＳ２Ｆ,072-767-6262,太陽光,500.0,滋賀県高島市新旭町深溝字西釜５３６,14,599.7,12月25日2014年,2016年3月,-,-,外部積立て,-,2036年1月
A868114E25,ダイイチファイナンシャルグループ住宅販売有限会社,代表取締役　米花　和幸,川西市小花１－２１－１４ＬＯＨＡＵＳ２階,072-767-6262,太陽光,500.0,滋賀県高島市新旭町深溝字西釜５２５－１他（別紙のとおり）,0,599.7,12月25日2014年,2016年3月,-,-,外部積立て,-,2036年1月
A868120E25,那須　康人,,,,太陽光,148.5,滋賀県彦根市平田町字下出９９２,3,148.5,12月25日2014年,2015年4月,-,-,外部積立て,-,2035年2月
A868121E25,明豊物産株式会社,本庄　浩二,長浜市加納町３９４,0749-63-5810,太陽光,250.0,滋賀県長浜市下之郷町字狭間５５６－１,3,250.0,12月25日2014年,2015年5月,-,-,外部積立て,-,2035年3月
A868125E25,株式会社伊藤佑ホールディングス,伊藤　侑祐,蒲生郡日野町大字里口３７,0748-52-2143,太陽光,147.1,滋賀県彦根市長曽根町字文田１７８,3,147.1,12月25日2014年,2015年4月,-,-,外部積立て,-,2035年3月
A868134E25,愛西土地改良区,黒澤　茂樹,滋賀県彦根市薩摩町３３７,0749-43-2261,太陽光,99.0,滋賀県彦根市田附町字道山寺２０５６,1,99.0,12月25日2014年,2016年1月,-,-,外部積立て,-,2035年11月
A868147E25,株式会社ケイズコーポレーション,代表取締役　古株　治美,近江八幡市上田町１３４８,0748-38-0016,太陽光,750.0,滋賀県蒲生郡竜王町大字小口字口山田９７４,7,750.0,1月8日2015年,2016年1月,-,-,外部積立て,-,2035年11月
A868156E25,湖北総合開発株式会社,植田　薫,彦根市甲田町５５５,0749-23-8330,太陽光,149.7,滋賀県彦根市野田山町字龍戸地８６４,1,174.4,1月8日2015年,2015年6月,-,-,外部積立て,-,2035年5月
A868615E25,小林　新治郎,,,,太陽光,47.9,滋賀県犬上郡豊郷町安食西高道４３９,0,53.0,11月21日2014年,2015年4月,-,-,外部積立て,-,2035年3月
A868655E25,株式会社　マツノ,松野　城士,東近江市湯屋町１２６３番地１,0749-45-1013,太陽光,49.5,滋賀県東近江市湯屋町１２６３－１,0,49.5,11月21日2014年,2015年2月,-,-,外部積立て,-,2034年12月
A868658E25,有限会社二十一世紀,藤原敏行,大阪府和泉市室堂町９６,,太陽光,49.5,滋賀県大津市栗原字西勝寺野１６０２－６１,1,69.3,11月21日2014年,2016年8月,無,無,外部積立て,-,2036年6月
A868662E25,有限会社　若林自動車工業,若林　満,彦根市賀田山町５４４,0749-28-0557,太陽光,21.7,滋賀県彦根市賀田山町５７５,0,21.7,11月21日2014年,2015年2月,-,-,外部積立て,-,2034年12月
A868673E25,湯浅　昇,,,,太陽光,49.5,滋賀県栗東市綣８－８８８,0,55.1,11月21日2014年,2015年9月,-,-,外部積立て,-,2035年8月
A868696E25,合同会社ＳＲＥ,岡田　ゆかり,大津市本丸町３－１５,,太陽光,47.2,滋賀県甲賀市信楽町黄瀬字角チ２０１７,0,69.3,11月21日2014年,2015年6月,-,-,外部積立て,-,2035年4月
A868710E25,株式会社東和テック,小澤茂雄,磐田市森下１００５－８,0538-67-1260,太陽光,47.2,滋賀県高島市安曇川町下小川２１９７－６,3,58.0,11月21日2014年,2015年5月,-,-,外部積立て,-,2035年3月
A868738E25,田中　朋樹,,,,太陽光,49.5,滋賀県大津市木の岡町字木ノ岡山６８４－３,0,49.5,11月21日2014年,2015年5月,-,-,外部積立て,-,2035年3月
A868739E25,田中　寛子,,,,太陽光,49.5,滋賀県大津市木の岡町木ノ岡山６９４－１,0,49.5,11月21日2014年,2015年5月,-,-,外部積立て,-,2035年3月
A868909E25,エルム測建株式会社,土山　定信,甲賀市土山町南土山甲４４０,0748-86-8046,太陽光,22.0,滋賀県甲賀市土山町山女原５０８,0,23.9,11月21日2014年,2016年7月,-,-,外部積立て,-,2036年5月
A868977E25,株式会社　木屋長工務店,和田　孝浩,東近江市東今崎町１２１０の１,0748-22-0148,太陽光,30.4,滋賀県東近江市蛇溝町字長谷野１１０３－１,0,30.4,11月21日2014年,2015年6月,-,-,外部積立て,-,2035年4月
A868982E25,竹田　晃二,,,,太陽光,33.0,滋賀県近江八幡市安土町下豊浦３１３９,4,37.0,11月21日2014年,2015年7月,-,-,外部積立て,-,2035年5月
A868983E25,橋本建設株式会社,橋本　亨,長浜市大浜町３８３,0749-72-2309,太陽光,48.9,滋賀県長浜市南浜町和田９３０,0,49.2,11月21日2014年,2015年8月,-,-,外部積立て,-,2035年6月
A869061E25,大重　勇樹,,,,太陽光,48.8,滋賀県東近江市南須田町字名後５３５,3,48.8,11月21日2014年,2016年9月,-,-,外部積立て,-,2036年7月
A869064E25,株式会社　ライフテックミツダ,光田　昌弘,東近江市今堀町６２１番地の１,0748-23-0667,太陽光,49.5,滋賀県蒲生郡日野町松尾１－３３,0,49.5,11月21日2014年,2015年5月,-,-,外部積立て,-,2035年4月
A869131E25,株式会社　山崎土木,山崎　政隆,犬上郡甲良町長寺１０２４－１,0749-38-3828,太陽光,23.6,滋賀県犬上郡甲良町長寺１０２４－１,0,24.0,11月21日2014年,2015年2月,-,-,外部積立て,-,2035年1月
A869133E25,株式会社佐藤医科器械製作所,佐藤　和雄,京都市中京区西洞院通御池上る押西洞院町６０６番地,075-221-4023,太陽光,49.5,滋賀県野洲市野洲１５１５－１,0,49.5,11月21日2014年,2015年9月,-,-,外部積立て,-,2035年7月
A869215E25,滋賀県東近江市,市長　小椋　正清,東近江市八日市緑町１０番５号,0748-55-8030,太陽光,20.0,滋賀県東近江市平松町１１１３,0,20.0,11月21日2014年,2015年7月,-,-,外部積立て,-,2035年5月
A869230E25,岡本アルミ建材株式会社,岡本　光司,高島市安曇川町中央２－４－７,0740-32-2178,太陽光,20.0,滋賀県高島市安曇川町中央２－４－８,0,21.0,11月21日2014年,2015年6月,-,-,外部積立て,-,2035年5月
A869289E25,株式会社丸商,福田　学,滋賀県大津市松本１‐４‐１　丸商ビル３階,077-510-0031,太陽光,23.2,滋賀県草津市笠山２－４－１７,0,24.4,11月21日2014年,2015年3月,-,-,外部積立て,-,2035年2月
A869300E25,西村　祐貴,,,,太陽光,20.3,滋賀県守山市立田町１７１８‐１,0,20.7,11月21日2014年,2016年7月,-,-,外部積立て,-,2036年5月
A869430E25,谷川　昌辰,,,,太陽光,49.5,滋賀県犬上郡豊郷町安食南一里山２９８－２,0,56.7,11月21日2014年,2016年2月,-,-,外部積立て,-,2035年12月
A869453E25,有限会社ロフトインターナショナル,岩村英満,京都市下京区西七条東御前田町４８,075-312-1426,太陽光,47.2,滋賀県彦根市西今町８４,0,53.0,11月21日2014年,2015年5月,-,-,外部積立て,-,2035年3月
A869803E25,株式会社　松本電気,松本　正美,栗東市目川１００２,077-552-5011,太陽光,41.5,滋賀県甲賀市水口町春日１－９２,0,41.5,12月1日2014年,2015年4月,-,-,外部積立て,-,2035年3月
A869816E25,保知　功,,,,太陽光,20.0,滋賀県近江八幡市安土町上豊浦６７６－２,1,21.1,12月1日2014年,2015年12月,-,-,外部積立て,-,2035年10月
A869820E25,有限会社大沢設備工業所,大澤　吉弘,大津市坂本４－８－７,077-578-1101,太陽光,49.6,滋賀県大津市坂本１－３４７－１,0,49.9,12月1日2014年,2015年5月,-,-,外部積立て,-,2035年3月
A869826E25,株式会社　港屋,谷口　正樹,彦根市肥田町９８０,0749-43-5630,太陽光,35.0,滋賀県彦根市稲枝町１４,0,41.7,12月1日2014年,2015年4月,-,-,外部積立て,-,2035年2月
A869890E25,久保田　寿則,,,,太陽光,22.0,滋賀県犬上郡多賀町川相３５０－１,0,22.9,12月1日2014年,2015年4月,-,-,外部積立て,-,2035年3月
A869897E25,合同会社　ＳＵＮ　ＲＩＳＥ,余谷公義,伊勢市御薗町王中島８２２－２,,太陽光,49.5,滋賀県長浜市高月町唐川２８６－２,0,49.5,12月1日2014年,2015年7月,-,-,外部積立て,-,2035年6月
A869943E25,株式会社水谷,水谷　直彦,高島市安曇川町西万木３４４－１,0740-32-2547,太陽光,27.5,滋賀県高島市安曇川町西万木３４４－４,0,33.2,12月1日2014年,2015年3月,-,-,外部積立て,-,2035年1月
A870030E25,彦根相互ホールディングス株式会社,松田　孝信,滋賀県彦根市西沼波町１６４,0749-27-0009,太陽光,38.4,滋賀県彦根市西沼波町１６４－１,0,44.2,12月1日2014年,2015年4月,-,-,外部積立て,-,2035年3月
A870040E25,園田　貢,,,,太陽光,43.7,滋賀県湖南市岩根４１４９,0,43.7,12月1日2014年,2015年6月,-,-,外部積立て,-,2035年4月
A870068E25,有限会社　上田花園,上田　太治,愛知郡愛荘町目加田２４４１－２,0749-42-2323,太陽光,49.5,滋賀県愛知郡愛荘町畑田四辻８３３－１,0,50.0,12月1日2014年,2015年5月,-,-,外部積立て,-,2035年3月
A870132E25,山川　光,,,,太陽光,20.0,滋賀県東近江市宮川町６９１－２７１,0,23.4,12月1日2014年,2015年4月,-,-,外部積立て,-,2035年2月
A870137E25,エグチホールディングス　株式会社,江口　勝義,名古屋市守山区大森４丁目１００２番地,052-798-2311,太陽光,49.9,滋賀県高島市マキノ町森西５９０－１,0,53.4,12月1日2014年,2015年6月,-,-,外部積立て,-,2035年5月
A870191E25,ウィナーズエナジー合同会社,勝部　寿久,守山市守山四丁目１３番７号南喜ビル１０５号,077-516-4245,太陽光,39.6,滋賀県野洲市菖蒲１０７,0,39.6,12月1日2014年,2015年6月,-,-,外部積立て,-,2035年5月
A870284E25,株式会社東和テック,小澤茂雄,磐田市森下１００５－８,0538-67-1280,太陽光,39.6,滋賀県高島市今津町北仰１９－４４,1,50.0,12月1日2014年,2015年10月,-,-,外部積立て,-,2035年8月
A870856E25,シンコー株式会社,杉本勇喜一,草津市笠山２丁目２４５番９,077-562-2156,太陽光,45.6,滋賀県草津市笠山２－２４５－９,0,45.6,12月4日2014年,2015年4月,-,-,外部積立て,-,2035年1月
A870857E25,堤　三治,,,,太陽光,22.2,滋賀県野洲市小堤３４－１０,0,22.2,12月4日2014年,2015年1月,-,-,外部積立て,-,2034年12月
A870869E25,シンコー株式会社,杉本勇喜一,草津市笠山２丁目２４７番１,077-562-2156,太陽光,37.8,滋賀県草津市笠山２－２４７－１,0,37.8,12月4日2014年,2015年4月,-,-,外部積立て,-,2035年1月
A870880E25,岡本　勝治,,,,太陽光,47.1,滋賀県草津市上寺町３３５－１,0,51.8,12月4日2014年,2015年6月,-,-,外部積立て,-,2035年4月
A870900E25,原田　保寿,,,,太陽光,21.0,滋賀県大津市平津１丁目字渡浜１００－２（番地未確定）,0,21.0,12月4日2014年,2018年2月,-,-,外部積立て,-,2037年10月
A870905E25,稲田　愛子,,,,太陽光,33.0,滋賀県栗東市岡字砂原２９０－１,0,33.0,12月4日2014年,2015年11月,-,-,外部積立て,-,2035年9月
A870962E25,高橋　直人,,,,太陽光,21.1,滋賀県愛知郡愛荘町安孫子６１５－３,0,21.1,12月4日2014年,2015年4月,-,-,外部積立て,-,2035年2月
A870981E25,株式会社　湖城ヶ丘ハイツ,井本　明伯,大津市湖城が丘１４番４３号,,太陽光,38.5,滋賀県甲賀市水口町中邸４０６４－３,2,38.5,12月4日2014年,2016年10月,-,-,外部積立て,-,2036年8月
A871036E25,山崎　惣治郎,,,,太陽光,27.2,滋賀県長浜市当目町３７４,0,28.5,12月4日2014年,2015年5月,-,-,外部積立て,-,2035年3月
A871080E25,木村　圭一,,,,太陽光,49.5,滋賀県甲賀市甲南町新治２３３４,0,50.0,12月4日2014年,2015年5月,-,-,外部積立て,-,2035年3月
A871085E25,株式会社　ファインエナジー,吉田　真一,甲賀市甲南町野尻９８７－５,0748-86-6335,太陽光,49.5,滋賀県甲賀市信楽町長野３６９,0,64.2,12月4日2014年,2016年2月,-,-,外部積立て,-,2036年1月
A871141E25,増井　直樹,,,,太陽光,21.4,滋賀県東近江市沖野４‐５‐２２,0,22.1,12月4日2014年,2015年5月,-,-,外部積立て,-,2035年3月
A871144E25,株式会社プラウド,松村　真,大阪府大阪市中央区北久宝寺町２－６－１０,06-6258-8894,太陽光,39.6,滋賀県大津市本堅田５－７－４０,0,41.3,12月4日2014年,2015年4月,-,-,外部積立て,-,2035年2月
A871160E25,森　直樹,,,,太陽光,20.0,滋賀県近江八幡市北之庄町１１５８,0,20.9,12月4日2014年,2015年7月,-,-,外部積立て,-,2035年5月
A871176E25,滋賀建機　株式会社,蔭山　明夫,愛知郡愛荘町中宿１６０－１,0747-42-8778,太陽光,49.5,滋賀県愛知郡愛荘町北八木９２,0,53.5,12月4日2014年,2015年5月,-,-,外部積立て,-,2035年3月
A871229E25,日東商事株式会社,熊木　治,彦根市田附町１３０７,0749-43-2802,太陽光,49.5,滋賀県東近江市今町１０２３,0,54.0,12月4日2014年,2015年6月,-,-,外部積立て,-,2035年4月
A871299E25,松本　正樹,,,,太陽光,41.3,滋賀県高島市今津町北仰２－１１,0,43.8,12月4日2014年,2015年5月,-,-,外部積立て,-,2035年3月
A871333E25,株式会社東和テック,小澤茂雄,磐田市森下１００５－８,0538-67-1280,太陽光,33.0,滋賀県高島市安曇川町下古賀字内垣外１５９４－３,1,36.8,12月4日2014年,2015年7月,-,-,外部積立て,-,2035年5月
A871340E25,株式会社　アビコ製作所,仲野清幸,草津市青地町２７０－１５,077-564-8227,太陽光,39.6,滋賀県草津市青地町２７０－１５,0,39.6,12月4日2014年,2015年4月,-,-,外部積立て,-,2035年2月
A871381E25,大西　明美,,,,太陽光,49.5,滋賀県米原市宇賀野字金八１１５２－１,0,63.5,12月4日2014年,2015年8月,-,-,外部積立て,-,2035年6月
A871409E25,橋本　透,,,,太陽光,33.6,滋賀県大津市穴太２－５２２－１,0,39.4,12月4日2014年,2015年3月,-,-,外部積立て,-,2035年2月
A871412E25,株式会社　エスケイカンポスト,金森　隆志,長浜市泉町１３７０,0749-68-1801,太陽光,49.5,滋賀県長浜市泉町１３７０,0,68.0,12月4日2014年,2015年7月,-,-,外部積立て,-,2035年5月
A871413E25,株式会社　エスケイカンポスト,金森　隆志,長浜市泉町１３７０,0749-68-1801,太陽光,27.0,滋賀県長浜市朝日町５１－１,0,27.0,12月4日2014年,2015年2月,-,-,外部積立て,-,2035年1月
A871414E25,株式会社　エスケイカンポスト,金森　隆志,長浜市泉町１３７０,0749-68-1801,太陽光,45.0,滋賀県長浜市湖北町八日市７５３－２,0,45.0,12月4日2014年,2015年4月,-,-,外部積立て,-,2035年2月
A871473E25,初田　早樹,,,,太陽光,23.6,滋賀県大津市北大路１－１１－２２,0,25.3,12月4日2014年,2015年11月,-,-,外部積立て,-,2035年7月
A872079E25,青木建材工業株式会社,青木　隆,長浜市祇園町１５４,0749-62-5190,太陽光,27.5,滋賀県長浜市祇園町１５７（複数需要場所）,0,29.1,12月1日2014年,2015年4月,-,-,外部積立て,-,2035年3月
A872082E25,鈴木織布株式会社,鈴木　庄也,高島市安曇川町四津川６４３,0740-34-0255,太陽光,43.5,滋賀県高島市安曇川町四津川字梅ノ木１５５６－１,0,43.5,12月1日2014年,2015年7月,-,-,外部積立て,-,2035年5月
A872159E25,五反田公民館,中尾　信雄,甲賀市甲賀町五反田３７２,0748-88-4737,太陽光,23.6,滋賀県甲賀市甲賀町五反田３７２,0,25.3,12月1日2014年,2015年2月,-,-,外部積立て,-,2034年12月
A872167E25,富田　清美,,,,太陽光,20.9,滋賀県東近江市横山町４２６,0,24.7,12月1日2014年,2015年9月,-,-,外部積立て,-,2035年8月
A872235E25,辻　薫,,,,太陽光,20.0,滋賀県東近江市建部上中町２２４,0,23.7,12月1日2014年,2015年4月,-,-,外部積立て,-,2035年2月
A872236E25,中澤　昌司,,,,太陽光,49.5,滋賀県東近江市五個荘金堂町柳５８９,0,53.0,12月1日2014年,2016年6月,-,-,外部積立て,-,2036年4月
A872354E25,田北　秀夫,,,,太陽光,49.5,滋賀県高島市マキノ町森西５５５－１５,0,49.5,12月1日2014年,2015年4月,-,-,外部積立て,-,2035年2月
A872391E25,古田　香織,,,,太陽光,49.3,滋賀県守山市木浜町字神田１６４１－１７,0,49.3,12月4日2014年,2015年7月,-,-,外部積立て,-,2035年5月
A872401E25,松田　ゑみ子,,,,太陽光,25.6,滋賀県大津市一里山１－８－８,0,25.6,12月4日2014年,2016年8月,-,-,外部積立て,-,2036年4月
A872411E25,中島　寛志,,,,太陽光,48.3,滋賀県甲賀市甲賀町神１４４２－２,0,48.3,12月4日2014年,2015年7月,-,-,外部積立て,-,2035年5月
A872414E25,福西　時三,,,,太陽光,21.1,滋賀県野洲市大津湖南都市計画市三宅東部土地区画整理事業施工地区２街区１,0,21.1,12月4日2014年,2015年8月,-,-,外部積立て,-,2035年6月
A872427E25,真藤　正一,,,,太陽光,22.0,滋賀県近江八幡市安土町下豊浦５１２５－４,0,24.8,12月4日2014年,2015年5月,-,-,外部積立て,-,2035年3月
A872428E25,北村　専次,,,,太陽光,22.0,滋賀県大津市衣川２－字西羅６５０－４０２,0,25.9,12月4日2014年,2015年9月,-,-,外部積立て,-,2035年7月
A872452E25,辻看板製作所,辻　賢宏,,,太陽光,43.7,滋賀県犬上郡豊郷町吉田１５０３－５,0,47.2,12月4日2014年,2015年3月,-,-,外部積立て,-,2035年2月
A872470E25,滋賀蒲生町農業協同組合葬祭ホール,角　清和,東近江市市子殿町２４０,0748-55-1171,太陽光,49.5,滋賀県東近江市市子殿町２９８,0,49.5,12月4日2014年,2015年8月,-,-,外部積立て,-,2035年7月
A872482E25,日本ソーラー電力株式会社,林　雄一郎,東京都品川区東五反田５－２７－１０　野村ビル８階,06-6943-5731,太陽光,49.5,滋賀県大津市竜が丘１－１８,0,60.1,12月4日2014年,2015年6月,-,-,外部積立て,-,2035年4月
A872500E25,株式会社ブルー,渡邉拓芳,神戸市東灘区本山南町９－８－３４,06-6131-9610,太陽光,49.5,滋賀県蒲生郡日野町別所２０１,3,49.5,12月4日2014年,2016年12月,-,-,外部積立て,-,2036年10月
A873328E25,小林　新治郎,,,,太陽光,33.0,滋賀県犬上郡豊郷町安食西高道４４０－１,0,36.2,12月9日2014年,2015年4月,-,-,外部積立て,-,2035年3月
A873329E25,奥村　紀樹,,,,太陽光,30.9,滋賀県草津市追分２－８－７、追分２－８－３５（複数需要場所）,0,36.0,12月9日2014年,2015年4月,-,-,外部積立て,-,2035年2月
A873356E25,池田　学,,,,太陽光,49.5,滋賀県犬上郡甲良町在士７０２－２,0,49.9,12月9日2014年,2015年9月,-,-,外部積立て,-,2035年8月
A873398E25,岩嶋　左千夫,,,,太陽光,49.5,滋賀県長浜市列見町本願寺２９１－１,0,54.6,12月9日2014年,2015年5月,-,-,外部積立て,-,2035年4月
