設備ID,発電事業者名,代表者名,事業者の住所,事業者の電話番号,発電設備区分,発電出力（kW）,発電設備の所在地,他の筆数,太陽電池の合計出力（kW）,新規認定日,運転開始報告年月,パワーコンディショナーの自立運転機能の有無,給電用コンセントの有無,廃棄費用の積立方法,廃棄費用の積立状況,調達期間終了年月
1B15684E25,土山バイオマス発電所合同会社,表原　弘幸,徳島県阿南市畭町三田７９－１,0884-24-9972,バイオマス,900.0,滋賀県甲賀市土山町南土山字中野乙２２５－１,1,-,1月5日2022年,-,-,-,-,運転開始前,-
6B64331E25,社会福祉法人オアシス倶楽部,野田　英彦,滋賀県近江八幡市馬淵町６９０,0748-38-0294,太陽光,47.1,滋賀県近江八幡市馬淵町６９０,0,49.6,12月12日2023年,2024年1月,有,有,外部積立て,-,2043年11月
6B65895525,リコーリース株式会社,中村　徳晴,東京都千代田区紀尾井町４－１,03-6204-0845,太陽光,1500.0,滋賀県湖南市大池町７－１,0,2338.5,1月18日2024年,2024年5月,-,-,外部積立て,-,2044年4月
6B68566E25,株式会社滋賀トヨタ,吉川　敦巳,滋賀県大津市本宮二丁目９番１２号,077-524-6711,太陽光,29.7,滋賀県栗東市上鈎２９４－１,0,35.5,1月12日2024年,2024年2月,有,有,外部積立て,-,2043年12月
6B71014E25,ツカサ産業株式会社,中園　孝行,滋賀県草津市岡本町８４５,077-561-4631,太陽光,150.0,滋賀県草津市山寺町２５０－１８,0,237.6,3月7日2024年,2024年8月,-,-,外部積立て,-,2044年6月
6B75000E25,株式会社センコーＰＰＡマネジメント,大橋　泰三,三重県四日市市北浜町８－１６,,太陽光,266.4,滋賀県草津市下物町字堤５１－１,1,354.2,3月6日2024年,2024年4月,-,-,外部積立て,-,2044年3月
6B78162E25,株式会社クスリのアオキ,青木　宏憲,石川県白山市松本町２５１２,076-274-1111,太陽光,150.0,滋賀県愛知郡愛荘町安孫子２４３,0,200.6,3月27日2024年,-,-,-,外部積立て,-,-
6B78167525,株式会社こほくエナジー,久木　裕,滋賀県長浜市木之本町小山４６５,0749-53-3306,太陽光,1000.0,滋賀県長浜市細江町８６４－４,0,1259.9,3月15日2024年,2024年5月,-,-,外部積立て,-,2044年4月
6B78344E25,株式会社クスリのアオキ,青木　宏憲,石川県白山市松本町２５１２,076-274-1111,太陽光,100.0,滋賀県栗東市目川１４３３,1,115.8,3月29日2024年,2024年6月,-,-,外部積立て,-,2044年4月
6B78467E25,株式会社クスリのアオキ,青木　宏憲,石川県白山市松本町２５１２,076-274-1111,太陽光,99.0,滋賀県長浜市加納町６５５－７,0,168.4,3月27日2024年,-,-,-,外部積立て,-,-
6B78472E25,株式会社クスリのアオキ,青木　宏憲,石川県白山市松本町２５１２,076-274-1111,太陽光,99.0,滋賀県東近江市八日市清水３－２－２７,1,136.8,3月29日2024年,-,-,-,外部積立て,-,-
6B78492E25,株式会社田村製作所,田村　友和,滋賀県草津市志那町１１２－３,,太陽光,34.6,滋賀県草津市志那町１１２－３,0,53.9,3月29日2024年,2024年5月,有,有,外部積立て,-,2044年3月
6B82211525,株式会社日本ベネックス,小林　洋平,長崎県諫早市津久葉町９９－４８,03-6261-5630,太陽光,900.0,滋賀県湖南市石部緑台１－２３１５－３２,0,1357.2,8月28日2024年,2024年8月,-,-,外部積立て,-,2044年7月
6B85056E25,臼井　琢磨,,,,太陽光,22.0,滋賀県東近江市鋳物師町字鳥居本１０３１,0,24.9,8月7日2024年,2024年9月,有,有,外部積立て,-,2044年7月
6B87553E25,中川絹糸株式会社,中川　嘉隆,滋賀県長浜市川道町２４８１,0749-72-3535,太陽光,150.0,滋賀県長浜市川道町字牛房屋２４２４－２,6,221.1,9月10日2024年,2025年1月,-,-,外部積立て,-,2044年11月
6B94597E25,紺藤織物株式会社,山川　藤治,滋賀県高島市新旭町藁園１４９８番地,0740-25-3431,太陽光,200.0,滋賀県高島市新旭町藁園字四ノ坪３４０２番地,0,274.5,10月7日2024年,2024年12月,-,-,外部積立て,-,2044年10月
6B94598E25,長岡産業株式会社,長岡　利典,滋賀県大津市粟津町２－６１,077-534-1730,太陽光,148.5,滋賀県大津市大石中６－２－１３,1,198.0,10月8日2024年,2025年1月,-,-,外部積立て,-,2044年11月
6B95963E25,滋賀ホンダ販売株式会社,橋本　昭吉,滋賀県大津市蓮池町１５‐１２,077-516-7350,太陽光,29.7,滋賀県草津市東矢倉２‐２３３‐５,0,67.5,11月18日2024年,-,有,有,外部積立て,-,-
6B99237E25,株式会社３６５－エステート,中村浩敏,滋賀県長浜市内保町３０１,0749-63-5508,太陽光,80.0,滋賀県長浜市内保町２５８－１,1,121.8,11月27日2024年,2025年3月,-,-,外部積立て,-,2045年1月
6C02135E25,株式会社多久製作所,山本　泰三,大阪府大阪市中央区本町２－５－７,06-6260-7080,太陽光,247.5,滋賀県甲賀市水口町ひのきが丘３３－２,0,518.4,1月6日2025年,-,-,-,外部積立て,-,-
6C03121E25,株式会社カネイ岡,岡真司,滋賀県長浜市木之本町千田２３６,0749-82-2033,太陽光,50.0,滋賀県長浜市木之本町千田２３６ー１,1,70.2,1月27日2025年,-,-,-,外部積立て,-,-
6C05442E25,株式会社３６５中村,中村浩敏,滋賀県長浜市内保町３０１,0749-63-5508,太陽光,249.9,滋賀県長浜市法楽寺町字岡東３４３,3,435.0,1月28日2025年,-,-,-,外部積立て,-,-
6C06060E25,株式会社コメリ,捧　雄一郎,新潟県新潟市南区清水４５０１－１,,太陽光,249.9,滋賀県米原市飯１０２２－１,1,422.3,2月10日2025年,-,-,-,外部積立て,-,-
6C06898E25,第十二日本ソーラー電力合同会社,第二電力株式会社　職務執行者　椎原　祥一朗,千葉県千葉市中央区富士見１－１４－１３千葉大栄ビル８階,03-5447-7008,太陽光,100.0,滋賀県湖南市石部北５－６－５,1,126.0,3月4日2025年,-,-,-,外部積立て,-,-
6C08134E25,淺野運輸倉庫株式会社,淺野　順一,滋賀県栗東市高野５８８,077-552-4511,太陽光,200.0,滋賀県栗東市高野５８８,3,319.0,2月26日2025年,-,-,-,外部積立て,-,-
6C08423E25,特定非営利活動法人　ゆうらいふ,山田　亘宏,滋賀県守山市立田町１２３１－４,077-584-2771,太陽光,38.5,滋賀県守山市川田町１５４１－４,0,44.3,2月27日2025年,-,有,有,外部積立て,-,-
6C09160E25,株式会社クスリのアオキ,青木　宏憲,石川県白山市松本町２５１２,076-274-1111,太陽光,99.0,滋賀県近江八幡市出町１８０,0,168.4,3月26日2025年,-,-,-,外部積立て,-,-
6C09167525,テス・エンジニアリング株式会社,髙崎　敏宏,大阪府大阪市淀川区西中島６－１－１,,太陽光,1999.0,滋賀県蒲生郡竜王町大字小口字ノ川原１０３８－１,14,2985.4,3月13日2025年,-,-,-,外部積立て,-,-
6C09169E25,株式会社クスリのアオキ,青木　宏憲,石川県白山市松本町２５１２,076-274-1111,太陽光,150.0,滋賀県近江八幡市安土町下豊浦８７１３－１,0,235.4,3月26日2025年,-,-,-,外部積立て,-,-
6C11615E25,義岡テクニカル株式会社,吉岡　秀晃,滋賀県栗東市手原７－５－２１,077-553-5538,太陽光,49.9,滋賀県栗東市手原８‐９３‐１,0,59.7,5月30日2025年,-,有,有,外部積立て,-,-
6C12897E25,長浜市,浅見　宣義,滋賀県長浜市八幡東町６３２,0749-62-4111,太陽光,20.8,滋賀県長浜市加田町２７２７,0,21.3,6月18日2025年,-,有,有,外部積立て,-,-
6C14369525,株式会社日本ベネックス,小林　洋平,長崎県諫早市津久葉町９９－４８,03-6261-5630,太陽光,1999.9,滋賀県湖南市石部緑台１‐２３１５‐１,0,6012.5,7月10日2025年,-,-,-,外部積立て,-,-
6Z98626E25,株式会社センコー,大森　功一,滋賀県甲賀市土山町前野１３８－２９,0748-67-8271,太陽光,200.0,滋賀県甲賀市土山町前野字鐘鋳野１３８－２９,0,286.9,12月21日2021年,2022年12月,-,-,外部積立て,-,2042年11月
A658306E25,湖東興産　株式会社,今若　伸男,東近江市上中野町９５６,0749-46-1570,太陽光,100.0,滋賀県東近江市上中野町９５６,0,111.3,6月29日2012年,2013年11月,-,-,外部積立て,-,2032年7月
A660191E25,大樹テクノス株式会社,加藤　治樹,東近江市池之尻町７０番地,,太陽光,49.8,滋賀県東近江市池之尻町７０,0,55.6,7月18日2012年,2013年11月,-,-,外部積立て,-,2032年8月
A661401E25,滋賀県電気工事工業組合,鹿野　敏夫,草津市青地２９９番地１号,077-562-2069,太陽光,49.6,滋賀県草津市青地町２９９－１,0,49.9,7月20日2012年,2013年11月,-,-,外部積立て,-,2032年8月
A664510E25,有限会社電脳自由亭,小杉　充,東近江市八日市町９番７号,0748-20-2320,太陽光,26.9,滋賀県東近江市八日市町９－７,0,26.9,7月26日2012年,2013年11月,-,-,外部積立て,-,2032年7月
A664968E25,丸喜建設株式会社,脇坂　喜好,東近江市園町１１３３－１,0749-46-0455,太陽光,49.8,滋賀県東近江市園町１１３３－１,0,52.8,8月2日2012年,2013年11月,-,-,外部積立て,-,2032年8月
A664969E25,金田　慎吾,,,,太陽光,49.8,滋賀県東近江市御園町３１,0,49.8,8月2日2012年,2013年11月,-,-,外部積立て,-,2032年9月
A664976E25,株式会社藤田電気工業,藤田　善志良,滋賀県東近江市小倉町１９３２,0749-46-1169,太陽光,22.4,滋賀県東近江市小倉町１９３２,0,25.6,7月31日2012年,2013年11月,-,-,外部積立て,-,2032年9月
A664979E25,兵神装備株式会社,市田　邦洋,神戸市兵庫区御崎本町１－１－５４,,太陽光,100.0,滋賀県長浜市高月町東物部１０２０,0,100.0,8月1日2012年,2013年11月,-,-,外部積立て,-,2032年10月
A667383E25,サンメディカル株式会社,鎌田　一則,守山市古高町５７１－２,077-582-9981,太陽光,90.7,滋賀県守山市古高町５７１－２,0,90.7,8月10日2012年,2013年11月,-,-,外部積立て,-,2032年11月
A677008E25,アキレス株式会社,日景　一郎,東京都新宿区北新宿２－２１－１,0284-73-9124,太陽光,503.2,滋賀県犬上郡豊郷町安食西１,0,503.2,8月16日2012年,2013年11月,-,-,外部積立て,-,2032年10月
A678158E25,株式会社高島デリバリー,荒木　深,高島市野田１６７８,0740-36-1007,太陽光,39.4,滋賀県高島市野田１６７８,0,39.4,8月22日2012年,2013年11月,-,-,外部積立て,-,2032年9月
A679533E25,ダイキン工業株式会社,十河　政則,大阪市北区中崎西２－４－１２,077-565-3348,太陽光,30.0,滋賀県草津市岡本町字大谷１０００－２,0,30.0,9月6日2012年,2013年11月,-,-,外部積立て,-,2032年9月
A679534E25,メニックス株式会社,櫻井　健太郎,滋賀県近江八幡市西庄町１８１０,0748-33-2550,太陽光,48.9,滋賀県近江八幡市西庄町１８１０,0,49.9,8月29日2012年,2013年11月,-,-,外部積立て,-,2033年2月
A686745E25,株式会社昭建,中村　智,大津市浜大津２－５－９,077-525-5131,太陽光,1811.8,滋賀県湖南市石部北２－２１０４,9,1811.8,9月11日2012年,2013年11月,-,-,外部積立て,-,2033年1月
A690397E25,長浜葬祭有限会社,西濱　一,長浜市神照町１４７－１,0749-63-3365,太陽光,47.9,滋賀県長浜市小堀町３９６－１,0,47.9,9月13日2012年,2013年11月,-,-,外部積立て,-,2033年1月
A691537E25,株式会社田村製作所,田村　友和,草津市志那町１１２－３,077-568-3190,太陽光,49.1,滋賀県草津市志那町１１２－３,0,52.7,9月18日2012年,2013年11月,-,-,外部積立て,-,2032年9月
A691563E25,湖東興産株式会社,今若　伸男,東近江市上中野町９５６,0749-46-1570,太陽光,37.3,滋賀県東近江市上中野町９７０－１,0,37.3,9月24日2012年,2013年11月,-,-,外部積立て,-,2032年11月
A691567E25,昭建ビル株式会社,中村　智,大津市浜大津２－５－９,077-525-5131,太陽光,22.0,滋賀県大津市三井寺１－３,0,24.5,9月24日2012年,2013年11月,-,-,外部積立て,-,2032年11月
A692981E25,キンキダンボール株式会社,井川　英郎,滋賀県草津市野路９－１３－１,077-563-0123,太陽光,141.0,滋賀県草津市野路９－１３－１,1,175.6,9月21日2012年,2013年11月,-,-,外部積立て,-,2032年11月
A694117E25,株式会社ミヤジマ,宮嶋　誠一郎,犬上郡多賀町多賀１００８,0749-48-0571,太陽光,27.5,滋賀県犬上郡多賀町多賀１００５,0,27.5,9月24日2012年,2013年11月,-,-,外部積立て,-,2032年10月
A695960E25,株式会社ハヤシ,林　秀光,彦根市高宮町１６６６－３,0749-23-1101,太陽光,40.0,滋賀県長浜市加納町４０４－１,0,41.0,9月24日2012年,2013年11月,-,-,外部積立て,-,2032年12月
A695964E25,一圓テクノス株式会社,一圓　宙貴,滋賀県彦根市小泉町７８－１０,0749-22-7974,太陽光,30.0,滋賀県彦根市小泉町７８－２６,0,30.0,9月25日2012年,2013年11月,-,-,外部積立て,-,2032年9月
A695978E25,株式会社橋本不動産,代表取締役　橋本　浩二,彦根市野口町２８３－２,0749-28-2777,太陽光,995.0,滋賀県東近江市五箇荘山本町字夏目６７６－１,4,1080.0,9月26日2012年,2013年11月,-,-,外部積立て,-,2033年1月
A695995E25,西和不動産販売株式会社,福島　正義,栗東市上鈎４５９－７,077-554-0880,太陽光,21.9,滋賀県栗東市安養寺１－３－１０,0,22.6,9月26日2012年,2013年11月,-,-,外部積立て,-,2032年9月
A696000E25,布部　重藏,,,,太陽光,26.7,滋賀県東近江市山路町２２４,0,26.7,9月26日2012年,2013年11月,-,-,外部積立て,-,2032年10月
A697977E25,村山工務店,村山　光,東近江市大萩町６４,,太陽光,23.4,滋賀県東近江市大萩町２５７,0,26.6,10月3日2012年,2013年11月,-,-,外部積立て,-,2033年4月
A697978E25,株式会社湖東工業所,上林　清作,愛知郡愛荘町安孫子２４９,0749-37-2883,太陽光,21.2,滋賀県愛知郡愛荘町安孫子２４９,0,21.3,10月3日2012年,2013年11月,-,-,外部積立て,-,2032年11月
A697985E25,真柄建設株式会社,真柄卓司,金沢市彦三町１－１３－４３,076-231-8001,太陽光,580.0,滋賀県大津市木戸字松本１４７２－１,23,600.0,10月4日2012年,2013年11月,-,-,外部積立て,-,2033年2月
A697990E25,株式会社近藤商事,近藤　静栄,京都市右京区梅津前田町３８,075-882-7575,太陽光,49.0,滋賀県大津市木戸字松本林１４８０－１,0,49.0,10月3日2012年,2013年11月,-,-,外部積立て,-,2033年7月
A697991E25,株式会社近藤農産,近藤　有子,京都市右京区梅津前田町３８,075-882-7575,太陽光,49.0,滋賀県大津市木戸字松本林１４８０,0,49.0,10月3日2012年,2013年11月,-,-,外部積立て,-,2033年7月
A698091E25,金田　慎吾,,,,太陽光,30.0,滋賀県東近江市瓜生津町７０９－３,0,30.8,10月16日2012年,2013年11月,-,-,外部積立て,-,2032年12月
A698092E25,金田　慎吾,,,,太陽光,24.5,滋賀県東近江市瓜生津町７０９－２,0,24.5,10月16日2012年,2013年11月,-,-,外部積立て,-,2032年12月
A698093E25,八日市精工株式会社,岡田　晶,東近江市青野町４５２０,0748-27-8177,太陽光,40.0,滋賀県東近江市沖野４－６－１８,0,41.4,10月16日2012年,2013年11月,-,-,外部積立て,-,2032年12月
A698106E25,堀内製粉,堀内　伸尚,,,太陽光,22.0,滋賀県甲賀市甲南町森尻３４５－１,0,25.0,10月4日2012年,2013年11月,-,-,外部積立て,-,2032年11月
A698133E25,株式会社高岡屋,宇野　彰一,草津市草津３－９－１４,0749-42-2394,太陽光,48.9,滋賀県愛知郡愛荘町長野３６４－１,0,48.9,10月4日2012年,2013年11月,-,-,外部積立て,-,2033年2月
A698137E25,株式会社長岡建設,長岡　範行,東近江市竜田町７０７－２,0748-48-5373,太陽光,42.2,滋賀県東近江市竜田町７０７－２,0,42.2,10月5日2012年,2013年11月,-,-,外部積立て,-,2032年9月
A698166E25,ワケンホールディングス株式会社,熊澤　康介,箕面市船場東１－１２－８,075-711-8118,太陽光,48.0,滋賀県草津市下笠町９４５－１,0,48.0,10月9日2012年,2013年11月,-,-,外部積立て,-,2032年11月
A698186E25,川瀬　仁,,,,太陽光,20.2,滋賀県草津市上笠２－１７－６,0,20.2,10月10日2012年,2013年11月,-,-,外部積立て,-,2032年10月
A698200E25,アガタ電子株式会社,縣　秀治,大津市月輪１－１３－４,077-547-3518,太陽光,38.5,滋賀県大津市月輪１－１３－４,0,38.5,10月9日2012年,2013年11月,-,-,外部積立て,-,2032年12月
A698203E25,秀熊電建工業株式会社,秀熊　順治,甲賀市水口町新城１５３－３,0748-62-3161,太陽光,49.0,滋賀県甲賀市水口町新城１５３－３,0,49.0,10月12日2012年,2013年11月,-,-,外部積立て,-,2033年1月
A698212E25,みのり苑株式会社,二柳　順藏,大津市和邇今宿３８４－３,077-594-1845,太陽光,27.4,滋賀県大津市和邇今宿３８４－３,0,27.4,10月17日2012年,2013年11月,-,-,外部積立て,-,2033年2月
A698222E25,株式会社オクテック,奥坂　芳博,野洲市野洲１７１３,077-587-4960,太陽光,38.5,滋賀県野洲市野洲１７１３,0,38.5,10月9日2012年,2013年11月,-,-,外部積立て,-,2032年11月
A698924E25,セキスイボード株式会社,戸根　光雄,甲賀市水口町泉１２５９,0748-62-0073,太陽光,1000.0,滋賀県甲賀市水口町泉１２５９,0,1000.0,10月23日2012年,2013年11月,-,-,外部積立て,-,2033年5月
A698943E25,野村　宗史,,,,太陽光,38.1,滋賀県甲賀市水口町泉２９７－６,0,38.1,10月15日2012年,2013年11月,-,-,外部積立て,-,2032年12月
A698948E25,株式会社三立運輸,本棒　直樹,米原市柏原６５－１,0749-57-1156,太陽光,48.0,滋賀県米原市柏原６５－１,0,51.3,10月12日2012年,2013年11月,-,-,外部積立て,-,2033年1月
A698949E25,株式会社清弘エンジニアリング,井畑　忠,栗東市伊勢落６３３－７,075-662-0746,太陽光,40.0,滋賀県栗東市伊勢落６３３－７,0,40.0,10月12日2012年,2013年11月,-,-,外部積立て,-,2032年12月
A698959E25,浅小井農園株式会社,松村　務,近江八幡市浅小井町９７２,077-523-3815,太陽光,22.0,滋賀県近江八幡市浅小井町２４８１,0,23.4,10月16日2012年,2013年11月,-,-,外部積立て,-,2032年10月
A698961E25,小島　和代,,,,太陽光,46.8,滋賀県高島市マキノ町知内中勢１５５,3,46.8,10月18日2012年,2013年11月,-,-,外部積立て,-,2033年7月
A698969E25,村地綜合木材株式会社,村地　一洋,蒲生郡竜王町綾戸３２８－３番地,0748-57-0615,太陽光,44.0,滋賀県蒲生郡竜王町綾戸３２８－３,0,49.8,10月18日2012年,2013年11月,-,-,外部積立て,-,2033年5月
A698974E25,蝶耀商事株式会社,白井　幸則,草津市北大萱町５５６－２,077-568-3190,太陽光,49.1,滋賀県守山市荒見町２２９－２,0,49.1,10月15日2012年,2014年2月,-,-,外部積立て,-,2033年12月
A698982E25,株式会社ティー・エス・ケー,乗松　良徳,京都市上京区下長者町通小川西入鷹司町６２,075-431-6141,太陽光,496.9,滋賀県大津市小野字クルゲ２９９－１,0,496.9,10月18日2012年,2013年11月,-,-,外部積立て,-,2033年1月
A698987E25,株式会社安藤製材所,安藤　哲也,彦根市出町７３,0749-28-2225,太陽光,99.2,滋賀県彦根市出町７３,0,101.6,9月11日2012年,2013年11月,-,-,外部積立て,-,2032年10月
A699573E25,株式会社コクヨ工業滋賀,大塚啓三,滋賀県愛知郡愛荘町上蚊野字下川原３１２,0749-37-3611,太陽光,200.0,滋賀県愛知郡愛荘町上蚊野３１２,0,200.0,10月15日2012年,2013年11月,-,-,外部積立て,-,2033年1月
A699589E25,新協化成工業株式会社,宮田　豊治,湖南市朝国５０４,0748-72-0228,太陽光,47.7,滋賀県湖南市朝国３１６－１,0,48.2,10月15日2012年,2013年11月,-,-,外部積立て,-,2032年11月
A699594E25,小島　亨,,,,太陽光,46.8,滋賀県高島市マキノ町知内字中勢１３９,3,46.8,10月18日2012年,2013年11月,-,-,外部積立て,-,2033年7月
A699604E25,滋賀建機株式会社,代表取締役　蔭山　明夫,愛知郡愛荘町中宿１６０－１,0749-42-8668,太陽光,990.0,滋賀県東近江市建部下野町１６,0,1168.1,10月17日2012年,2013年11月,-,-,外部積立て,-,2033年2月
A699619E25,株式会社イーテック・ソリューションズ,山北　善和,東近江市上大森町８２７,0748-23-8667,太陽光,36.8,滋賀県東近江市上大森町８２７,0,36.8,10月19日2012年,2013年11月,-,-,外部積立て,-,2033年4月
A699632E25,株式会社　昇羽,宮口　正利,滋賀県草津市木川町４３０番地,,太陽光,27.3,滋賀県草津市北大萱町５４３－１,0,27.3,10月15日2012年,2013年11月,-,-,外部積立て,-,2032年11月
A699640E25,一般社団法人コナン市民共同発電所プロジェクト,溝口　弘,滋賀県湖南市石部東１－９－２６,0748-76-3792,太陽光,20.8,滋賀県湖南市西峰町１－１,0,20.8,10月17日2012年,2013年11月,-,-,外部積立て,-,2033年1月
A700009E25,株式会社小崎工業,小崎　高重,長浜市三田町１４２３－３,0749-74-8000,太陽光,100.0,滋賀県長浜市三田町１４２３－３,0,100.0,10月15日2012年,2013年11月,-,-,外部積立て,-,2033年1月
A700689E25,三協自動車株式会社,下中　喜明,甲賀市甲南町野尻６４５－１,0748-86-7859,太陽光,47.5,滋賀県甲賀市甲南町野尻６４５－１,0,47.5,10月16日2012年,2013年11月,-,-,外部積立て,-,2032年12月
A700717E25,甲陸湖南有限会社,甲斐切　稔,湖南市小砂町４番３,0748-72-2840,太陽光,990.0,滋賀県湖南市小砂町４－３,0,1002.0,10月17日2012年,2013年11月,-,-,外部積立て,-,2033年1月
A701258E25,株式会社アルサスエンジニアリング,澤田　友司,甲賀市甲南町葛木６２,0748-86-0020,太陽光,49.1,滋賀県甲賀市甲南町葛木６２,0,50.1,10月17日2012年,2013年11月,-,-,外部積立て,-,2033年3月
A701688E25,和気産業株式会社,宮地　龍,東大阪市南上小阪１０－３２,06-6723-5551,太陽光,100.0,滋賀県蒲生郡日野町第二工業団地３－２,0,100.0,10月19日2012年,2013年11月,-,-,外部積立て,-,2033年2月
A701718E25,大津板紙株式会社,熊本　吉喜,滋賀県大津市馬場１－１５－１５,,太陽光,250.0,滋賀県大津市国分２－２５５－３,0,250.0,10月19日2012年,2013年11月,-,-,外部積立て,-,2033年2月
A701763E25,株式会社堀内,堀内　金造,芦屋市山手町６－２５,06-6451-4091,太陽光,100.0,滋賀県湖南市柑子袋２２８,0,100.8,10月18日2012年,2013年11月,-,-,外部積立て,-,2033年2月
A701781E25,株式会社種新,代表取締役　谷口　一博,湖南市下田６３８－７２,0748-65-2533,太陽光,100.0,滋賀県甲賀市水口町八田９２７－３,0,110.0,10月19日2012年,2013年11月,-,-,外部積立て,-,2033年2月
A702462E25,彦根倉庫株式会社,西村　隆,犬上郡多賀町敏満寺７２７番地－１,0749-48-8080,太陽光,750.0,滋賀県犬上郡多賀町敏満寺７２７－１,0,750.0,10月23日2012年,2013年11月,-,-,外部積立て,-,2033年1月
A702488E25,株式会社横江ファーム,横江　傳造,草津市北山田町２２５４－４,077-568-8250,太陽光,22.2,滋賀県草津市北山田町２２５４－４,0,23.4,10月30日2012年,2013年11月,-,-,外部積立て,-,2032年11月
A702490E25,株式会社シンケン工業,中本　景幸,大津市野郷原２－１－２,077-545-5362,太陽光,23.1,滋賀県彦根市平田町７４４－１１,0,23.2,10月26日2012年,2013年11月,-,-,外部積立て,-,2032年12月
A702494E25,株式会社タニケン,谷口　秀治,彦根市小泉町１０６－１２,0749-27-3808,太陽光,272.5,滋賀県犬上郡甲良町尼子２４３７,0,272.5,11月5日2012年,2013年11月,-,-,外部積立て,-,2033年2月
A702512E25,大橋　重範,,,,太陽光,49.9,滋賀県長浜市下之郷町７２２－１,2,62.1,10月23日2012年,2013年11月,-,-,外部積立て,-,2033年4月
A702518E25,株式会社オートクラフト,安岡　清,甲賀市水口町酒人７５２,0748-62-1092,太陽光,42.3,滋賀県甲賀市水口町酒人７５２,0,48.5,10月24日2012年,2013年11月,-,-,外部積立て,-,2033年2月
A702519E25,株式会社オートクラフト,安岡　清,甲賀市水口町酒人７５２,0748-62-1092,太陽光,46.4,滋賀県甲賀市水口町酒人１０２０－１,0,50.1,10月24日2012年,2013年11月,-,-,外部積立て,-,2033年2月
A702524E25,大黒　智行,,,,太陽光,22.0,滋賀県彦根市正法寺町５６２,0,22.4,10月24日2012年,2013年11月,-,-,外部積立て,-,2032年11月
A702534E25,塚本　隆一,,,,太陽光,27.1,滋賀県東近江市八日市金屋３－３４７,0,27.1,10月31日2012年,2013年11月,-,-,外部積立て,-,2033年2月
A702556E25,株式会社木屋長工務店,和田　孝浩,東近江市栄町７－１,0748-23-0667,太陽光,20.4,滋賀県東近江市西中野町９－２９,0,20.4,10月24日2012年,2013年11月,-,-,外部積立て,-,2033年2月
