A792932E25,佐川印刷株式会社,江口　宏,向日市森本町戌亥５－３,0748-53-8181,太陽光,1990.0,滋賀県蒲生郡日野町大字北脇字中瀬２１４－９３、２１４、２１４－９０、字細田１５５－４、１５５－５、１２８－１、１２８、字中畑７５－２、７５－２５、７５－２６、字丸山続キ３８－７７、字下り松１４４、他９筆,0,1990.0,1月14日2014年,2014年5月,-,-,外部積立て,-,2034年3月
A792936E25,小泉産業株式会社,権藤　浩二,大阪府大阪市中央区備後町３－３－１１,06-6262-1352,太陽光,250.0,滋賀県東近江市大塚町１２８９－２,0,250.0,1月14日2014年,2014年11月,-,-,外部積立て,-,2034年10月
A792941E25,生活協同組合コープしが,白石　一夫,野洲市冨波甲９７２,077-586-1112,太陽光,100.0,滋賀県東近江市五個荘町清水鼻１５３－１,0,100.0,1月15日2014年,2014年10月,-,-,外部積立て,-,2034年8月
A792944E25,太陽運輸株式会社,竹備　裕二,長浜市高月町森本１００,0749-85-3411,太陽光,473.2,滋賀県東近江市乙女浜町字上浮６９５－１,0,473.2,1月15日2014年,2015年3月,-,-,外部積立て,-,2035年1月
A792950E25,株式会社スリーエー,代表取締役　竹山　圭司,愛知郡愛荘町豊満４９１－５,0749-42-2610,太陽光,495.0,滋賀県愛知郡愛荘町愛知川字采女６６８,5,548.4,1月15日2014年,2014年4月,-,-,外部積立て,-,2034年2月
A792954E25,関包スチール株式会社,谷本　隆弘,大阪市西区靱本町１－６－２１,06-6449-8811,太陽光,306.0,滋賀県甲賀市甲南町柑子字御所２００２－２３,0,324.0,1月15日2014年,2014年8月,-,-,外部積立て,-,2034年6月
A792960E25,株式会社泉倉庫,岸村　嘉幸,甲賀市水口町泉１１５０－１,0748-62-0681,太陽光,250.0,滋賀県甲賀市水口町泉１１５０－１,0,252.0,1月17日2014年,2014年8月,-,-,外部積立て,-,2034年6月
A792962E25,株式会社エムエフケー,矢田　勉,大阪府大阪市都島区東野田町２－３－１９,06-6353-4839,太陽光,1990.0,滋賀県甲賀市甲賀町隠岐字鍛冶山田２４０３－１５,1,1990.0,1月17日2014年,2014年11月,-,-,外部積立て,-,2034年9月
A792963E25,株式会社エムエフケー,矢田　勉,大阪府大阪市都島区東野田町２－３－１９,06-6353-4839,太陽光,1990.0,滋賀県甲賀市甲賀町隠岐字鍛冶山田２４０３－１５,1,1990.0,1月17日2014年,2014年8月,-,-,外部積立て,-,2034年6月
A792964E25,株式会社エムエフケー,矢田　勉,大阪府大阪市都島区東野田町２－３－１９,06-6353-4839,太陽光,1990.0,滋賀県甲賀市甲賀町隠岐字鍛冶山田２４０３－１５,1,1990.0,1月17日2014年,2014年10月,-,-,外部積立て,-,2034年8月
A792966E25,株式会社伊藤佑ホールディングス,伊藤　裕祐,蒲生郡日野町大字里口３７,0748-52-2143,太陽光,500.0,滋賀県甲賀市甲賀町神字滝谷１２９－１,16,517.5,1月17日2014年,2015年1月,-,-,外部積立て,-,2034年11月
A792978E25,湖東興産株式会社,代表取締役　今若　伸男,東近江市上中野町９５６,0749-46-1570,太陽光,350.0,滋賀県東近江市市ケ原町字市ケ原７２,0,385.0,1月20日2014年,2014年9月,-,-,外部積立て,-,2034年7月
A792983E25,株式会社フジックス,藤井　一郎,京都市北区平野宮本町５,075-744-0770,太陽光,250.0,滋賀県東近江市尻無町９８８,0,261.6,1月20日2014年,2014年8月,-,-,外部積立て,-,2034年6月
A792989E25,株式会社白畑建設,白畑　亜矢子,滋賀県草津市追分南３－２－３６,077-563-1359,太陽光,346.5,滋賀県甲賀市信楽町長野字広芝１３７７－１,1,364.5,1月20日2014年,2021年1月,-,-,外部積立て,-,2040年2月
A792992E25,松井商事株式会社,松井　昌彦,枚方市養父丘２－３－９,072-857-7450,太陽光,398.0,滋賀県甲賀市信楽町小川１３５４,0,402.5,1月20日2014年,2015年11月,-,-,外部積立て,-,2035年9月
A792995E25,湖東興産株式会社,代表取締役　今若　伸男,東近江市上中野町９５６,0749-46-1570,太陽光,102.0,滋賀県東近江市五智町奥野３７８,2,122.0,1月20日2014年,2015年10月,-,-,外部積立て,-,2035年8月
A792996E25,株式会社間口,前田　克巳,大阪市港区海岸通１－５－２９,06-7688-5723,太陽光,250.0,滋賀県高島市安曇川町南船木１－９,7,250.0,1月20日2014年,2015年2月,-,-,外部積立て,-,2034年12月
A793008E25,シャディ株式会社,矢野　輝治,東京都港区虎ノ門４－３－１,03-5400-5800,太陽光,500.0,滋賀県東近江市五個荘小幡１５１,0,560.0,1月22日2014年,2014年11月,-,-,外部積立て,-,2034年9月
A793023E25,第一工流株式会社,代表取締役　木下　知明,野洲市野洲１３３８,077-514-4177,太陽光,128.1,滋賀県野洲市野洲１３３８,0,128.1,1月24日2014年,2015年11月,-,-,外部積立て,-,2035年10月
A793028E25,株式会社手原産業倉庫,今井　潤一,野洲市野洲１５４８,077-587-0554,太陽光,750.0,滋賀県栗東市蜂屋字中田中５８７－４、５８７－５、５８９－１、５９０－１、５９２－１、５９３、５９３－８、上田中７４１－１、７４２－１、７４２－２、７４２－３、７４３、７４４－１、下虫喰７９２－１他１８筆,0,768.0,1月24日2014年,2014年9月,-,-,外部積立て,-,2034年7月
A793032E25,センコーグループホールディングス株式会社,福田　泰久,東京都江東区潮見２－８－１０,03-6862-5210,太陽光,250.0,滋賀県守山市吉身５丁目字ヘコ田６０－１,3,266.0,1月27日2014年,2014年6月,-,-,外部積立て,-,2034年4月
A793033E25,たち建設株式会社,代表取締役　猪飼　英男,栗東市六地蔵１１０３－２,077-552-0767,太陽光,1319.0,滋賀県栗東市六地蔵字丸塚７０－２,0,1330.0,1月28日2014年,2014年10月,-,-,外部積立て,-,2034年8月
A793034E25,株式会社ネクスト,辻　由夫,草津市南草津２－４－１０,077-566-0101,太陽光,1000.0,滋賀県甲賀市信楽町神山字後壷２６２４,3,1000.0,1月28日2014年,2015年11月,-,-,外部積立て,-,2035年9月
A793038E25,株式会社リンクス,上田　茂行,大津市西の庄１９－１０,077-521-2110,太陽光,600.0,滋賀県彦根市松原町字網代口１４３５－８９,0,715.6,1月28日2014年,2015年2月,-,-,外部積立て,-,2034年12月
A793045E25,株式会社栗東ハウジング,岡田　学,栗東市小柿５－１１－３－１号,077-553-4466,太陽光,980.0,滋賀県甲賀市信楽町神山字石橋２６３２,7,980.0,1月28日2014年,2015年11月,-,-,外部積立て,-,2035年9月
A793082E25,有限会社名神彦根オート,伊藤　親二,彦根市西沼波町１８９－１,0749-24-1170,太陽光,100.0,滋賀県彦根市極楽寺町６１０－１,0,104.1,1月29日2014年,2014年7月,-,-,外部積立て,-,2034年5月
A793083E25,ＳＢＩスマートエナジー株式会社,河原　武志,東京都港区六本木１－６－１,,太陽光,190.7,滋賀県彦根市極楽寺町字馬之頭６１０－２,0,190.7,1月29日2014年,2014年7月,-,-,外部積立て,-,2034年5月
A793094E25,アキレス株式会社,日景　一郎,東京都新宿区北新宿２－２１－１,0284-73-9124,太陽光,490.0,滋賀県犬上郡豊郷町安倉西１,0,503.2,1月30日2014年,2015年1月,-,-,外部積立て,-,2034年11月
A793106E25,クリエイション株式会社,河村　一広,京都市右京区西院平町２５,075-322-9879,太陽光,477.3,滋賀県大津市北小松字大堂１５７７,4,477.3,1月30日2014年,2014年11月,-,-,外部積立て,-,2034年10月
A793129E25,関東礦油株式会社,阿部　典夫,東京都港区芝大門２－１－１６,03-3434-6311,太陽光,750.0,滋賀県蒲生郡竜王町小口１１３０－１,0,762.3,2月3日2014年,2014年8月,-,-,外部積立て,-,2034年6月
A793130E25,株式会社近畿理研,川下　重彦,甲賀市土山町北土山１６６２,0748-66-1143,太陽光,181.5,滋賀県彦根市柳川町３５３－１,1,181.5,2月3日2014年,2014年8月,-,-,外部積立て,-,2034年6月
A793180E25,株式会社　イノダ,猪田　正治,東近江市五個荘簗瀬町８４７番地の５,0748-48-3156,太陽光,49.0,滋賀県東近江市五個荘河曲町字横田３３５,0,54.0,1月17日2014年,2014年3月,-,-,外部積立て,-,2034年1月
A793233E25,倉田建設　株式会社,倉田　紀康,甲賀市水口町北内貴４００,0748-62-4133,太陽光,38.5,滋賀県甲賀市土山町徳原字滝ノ坪８７３－１,3,44.0,1月17日2014年,2014年12月,-,-,外部積立て,-,2034年10月
A793235E25,倉田建設　株式会社,倉田　紀康,甲賀市水口町北内貴４００,0748-62-4133,太陽光,38.5,滋賀県甲賀市土山町徳原字滝ノ坪８３７－１,3,44.0,1月17日2014年,2014年12月,-,-,外部積立て,-,2034年10月
A793237E25,倉田建設　株式会社,倉田　紀康,甲賀市水口町北内貴４００,0748-62-4133,太陽光,38.5,滋賀県甲賀市土山町徳原字滝ノ坪８３７－１,3,44.0,1月17日2014年,2014年12月,-,-,外部積立て,-,2034年10月
A793239E25,倉田建設　株式会社,倉田　紀康,甲賀市水口町北内貴４００,0748-62-4133,太陽光,38.5,滋賀県甲賀市土山町徳原字滝ノ坪８３７－１,3,44.0,1月17日2014年,2014年12月,-,-,外部積立て,-,2034年10月
A793275E25,寺田　良泰,,,,太陽光,39.6,滋賀県東近江市永源寺相谷町１３１４,0,39.6,1月17日2014年,2020年2月,-,-,外部積立て,-,2039年12月
A793289E25,株式会社　谷與,谷　昌宏,湖南市下田２６６,0748-75-0029,太陽光,38.5,滋賀県湖南市下田２６６,0,41.7,1月20日2014年,2014年9月,-,-,外部積立て,-,2034年7月
A793355E25,株式会社　太田産業,太田　進,近江八幡市倉橋部町１４６－５,0748-37-2010,太陽光,49.5,滋賀県近江八幡市浄土寺町芦洗３６６－１,0,50.2,1月20日2014年,2014年7月,-,-,外部積立て,-,2034年5月
A793358E25,株式会社　太田産業,太田　進,近江八幡市倉橋部町１４６－５,0748-37-2010,太陽光,39.9,滋賀県近江八幡市東川町２１９－３,0,49.9,1月20日2014年,2014年12月,-,-,外部積立て,-,2034年10月
A793418E25,丸滋製陶株式会社,今井　智一,甲賀市信楽町長野９５３,0748-82-0033,太陽光,38.5,滋賀県甲賀市信楽町長野３９６,0,41.6,1月20日2014年,2014年7月,-,-,外部積立て,-,2034年5月
A794799E25,宇野　照夫,,,,太陽光,22.0,滋賀県草津市青地町字後町５５７－２,0,23.0,1月22日2014年,2014年5月,-,-,外部積立て,-,2034年3月
A794804E25,福井　チエ子,,,,太陽光,24.0,滋賀県草津市野路８丁目字内山１６３２－１,0,24.0,1月22日2014年,2014年8月,-,-,外部積立て,-,2034年7月
A794937E25,北川　昭,,,,太陽光,23.0,滋賀県彦根市川瀬馬場町６６９－１,0,23.0,1月22日2014年,2014年6月,-,-,外部積立て,-,2034年4月
A794957E25,日本観光開発株式会社,代表取締役　南　啓次郎,草津市大路３丁目５－６４,077-562-1049,太陽光,49.5,滋賀県草津市大路３－５－８,0,52.6,1月22日2014年,2014年6月,-,-,外部積立て,-,2034年5月
A794960E25,北村工務店,北村卓造,米原市顔戸１３６１－２０,0749-50-6327,太陽光,23.6,滋賀県米原市寺倉４４５－１,0,25.1,1月22日2014年,2014年12月,-,-,外部積立て,-,2034年11月
A794962E25,太田　一郎,,,,太陽光,47.1,滋賀県栗東市辻字曾根田４９９－１,0,49.7,1月22日2014年,2014年7月,-,-,外部積立て,-,2034年4月
A794981E25,株式会社興和コーポレーション,長谷川　欽哉,滋賀県草津市南笠東３－１５－５,075-222-0880,太陽光,23.2,滋賀県草津市南笠東３－１５－５,0,23.2,1月22日2014年,2014年8月,-,-,外部積立て,-,2034年7月
A794989E25,株式会社山崎不動産,山崎　孝雄,甲賀市水口町暁４番４６号,0748-62-0136,太陽光,49.7,滋賀県甲賀市土山町大野字千代２７２０－１,0,49.7,1月22日2014年,2014年7月,-,-,外部積立て,-,2034年6月
A795025E25,田口　義夫,,,,太陽光,39.6,滋賀県彦根市大藪町寄洲１８７６－１,0,48.9,1月22日2014年,2015年12月,-,-,外部積立て,-,2035年10月
A795030E25,田口　義夫,,,,太陽光,39.6,滋賀県彦根市大藪町寄洲１８７６－１,0,48.9,1月22日2014年,2015年12月,-,-,外部積立て,-,2035年10月
A795035E25,中野　和幸,,,,太陽光,27.8,滋賀県大津市月輪３－２８－２,0,27.8,1月22日2014年,2014年5月,-,-,外部積立て,-,2034年2月
A795037E25,東近江市,小椋正清,,,太陽光,48.7,滋賀県東近江市五個荘小幡町２２７,0,48.7,1月22日2014年,2014年8月,-,-,外部積立て,-,2034年7月
A795079E25,原田　穂積,,,,太陽光,22.0,滋賀県近江八幡市安土町常楽寺７３４,0,22.0,1月22日2014年,2014年5月,-,-,外部積立て,-,2034年2月
A795080E25,西野　茂樹,,,,太陽光,28.4,滋賀県野洲市冨波乙８２４－１,0,28.4,1月22日2014年,2014年6月,-,-,外部積立て,-,2034年5月
A795154E25,株式会社瀬戸組,瀬戸　靖二,甲賀市甲賀町油日１８０５,0748-88-4662,太陽光,30.0,滋賀県甲賀市甲賀町油日１８０５,0,35.6,1月22日2014年,2014年6月,-,-,外部積立て,-,2034年4月
A795177E25,西河　正樹,,,,太陽光,29.1,滋賀県蒲生郡日野町蓮花寺６４０,0,29.1,1月22日2014年,2014年4月,-,-,外部積立て,-,2034年2月
A795247E25,谷口　勝彦,,,,太陽光,48.8,滋賀県栗東市御園４９０,1,48.8,1月22日2014年,2014年6月,-,-,外部積立て,-,2034年4月
A795348E25,有限会社ＫＥＩＪＩ,小杉　新,京都市伏見区小栗栖森本町２０－１１９,075-575-1510,太陽光,48.6,滋賀県大津市伊香立下龍華町４４－１,1,48.6,1月22日2014年,2014年7月,-,-,外部積立て,-,2034年6月
A795349E25,有限会社ＫＥＩＪＩ,小杉　新,京都市伏見区小栗栖森本町２０－１１９,075-575-1510,太陽光,48.6,滋賀県大津市伊香立下龍華町４４－１,1,48.6,1月22日2014年,2014年7月,-,-,外部積立て,-,2034年6月
A795374E25,合同会社上空,上野　兵一,彦根市西今町６０８,0749-26-0261,太陽光,49.8,滋賀県彦根市西今町７３５,1,55.6,1月22日2014年,2014年7月,-,-,外部積立て,-,2034年4月
A795376E25,合同会社上空,上野　兵一,彦根市西今町６０８,0749-26-0261,太陽光,49.6,滋賀県彦根市西今町７３６,1,51.9,1月22日2014年,2014年7月,-,-,外部積立て,-,2034年4月
A795378E25,合同会社上空,上野　兵一,彦根市西今町６０８,0749-26-0261,太陽光,49.2,滋賀県彦根市西今町７３５,1,52.8,1月22日2014年,2014年7月,-,-,外部積立て,-,2034年4月
A795379E25,合同会社上空,上野　兵一,彦根市西今町６０８,0749-26-0261,太陽光,38.2,滋賀県彦根市西今町７３５,1,46.4,1月22日2014年,2014年7月,-,-,外部積立て,-,2034年4月
A795383E25,吉田　祐二,,,,太陽光,49.5,滋賀県甲賀市土山町北土山字田中２５６５,0,61.2,1月22日2014年,2014年7月,-,-,外部積立て,-,2034年5月
A795384E25,吉田　祐二,,,,太陽光,49.5,滋賀県甲賀市土山町北土山字田中２５６５－１,0,49.9,1月22日2014年,2014年7月,-,-,外部積立て,-,2034年6月
A796042E25,住マイライフ有限会社,岡田　正明,大津市南郷６丁目１３０９－１５,077-534-1188,太陽光,47.0,滋賀県大津市石山外畑町２４－２,0,63.4,1月24日2014年,2014年7月,-,-,外部積立て,-,2034年5月
A796044E25,住マイライフ有限会社,岡田　正明,大津市南郷６丁目１３０９－１５,077-534-1188,太陽光,47.4,滋賀県大津市石山外畑町字白砂２４－２,0,52.7,1月24日2014年,2014年5月,-,-,外部積立て,-,2034年3月
A796088E25,株式会社　Ｌｅ　ｃｉｅｌ,木村　征夫,草津市矢倉一丁目２－２６,077-562-0301,太陽光,36.0,滋賀県草津市矢倉１（番地未確定）,0,36.0,1月24日2014年,2014年10月,-,-,外部積立て,-,2034年8月
A796094E25,株式会社　Ｌｅ　ｃｉｅｌ,木村　征夫,草津市矢倉一丁目２－２６,077-562-0301,太陽光,21.4,滋賀県草津市矢倉１－２－１１,0,21.4,1月24日2014年,2015年4月,-,-,外部積立て,-,2035年3月
A796096E25,株式会社　ケイテック,代表取締役　小森　茂樹,湖南市夏見３７５番地１,0748-72-1804,太陽光,49.5,滋賀県湖南市夏見３７５－１,0,53.0,1月24日2014年,2015年5月,-,-,外部積立て,-,2035年3月
A796115E25,特定非営利活動法人　きずな,今村　秀子,東近江市佐野町４８４－３０,0749-42-8300,太陽光,23.4,滋賀県愛知郡愛荘町長野２３８０－１１,0,25.2,1月24日2014年,2014年5月,-,-,外部積立て,-,2034年3月
A796119E25,株式会社レイマック,田中　守,滋賀県守山市幸津川町１５５１,077-585-6767,太陽光,44.0,滋賀県守山市幸津川町１５４３－４,0,44.0,1月24日2014年,2014年6月,-,-,外部積立て,-,2034年4月
A796134E25,高田　正治,,,,太陽光,20.0,滋賀県栗東市野尻２６４,0,25.1,1月24日2014年,2014年11月,-,-,外部積立て,-,2034年8月
A796197E25,清水　健庄,,,,太陽光,33.0,滋賀県野洲市小篠原字高苗代１７０５－１,0,36.7,1月24日2014年,2014年6月,-,-,外部積立て,-,2034年4月
A796219E25,柏木　正隆,,,,太陽光,40.0,滋賀県甲賀市水口町北脇字藤木２０４－１,0,46.8,1月24日2014年,2015年7月,-,-,外部積立て,-,2035年6月
A796829E25,オキシー株式会社,本田　国松,草津市山寺町１１５４－３７,077-561-8948,太陽光,33.0,滋賀県草津市山寺町７０９－４,0,42.9,1月29日2014年,2016年5月,-,-,外部積立て,-,2036年3月
A796830E25,株式会社セイノ―マテリアル,代表取締役　井原　拓,大垣市赤坂町１０１,0584-72-2711,太陽光,49.5,滋賀県蒲生郡日野町大谷字東山４１６－７,0,54.0,1月29日2014年,2014年7月,-,-,外部積立て,-,2034年5月
A796894E25,株式会社　東和不動産,代表取締役　林佐智夫,栗東市霊仙寺２丁目１－２９,077-554-1188,太陽光,30.0,滋賀県栗東市野尻１２１－２,0,33.0,1月29日2014年,2016年8月,-,-,外部積立て,-,2036年5月
A796896E25,株式会社　東和不動産,代表取締役　林佐智夫,栗東市霊仙寺２丁目１－２９,077-554-1188,太陽光,20.0,滋賀県栗東市野尻１２０－４,0,21.0,1月29日2014年,2016年10月,-,-,外部積立て,-,2036年5月
A796937E25,伊庭　嘉兵衞,,,,太陽光,41.9,滋賀県草津市新浜町字北浜１６８－１,0,49.7,1月29日2014年,2014年7月,-,-,外部積立て,-,2034年6月
A796938E25,株式会社小西自動車,小西　市蔵,湖南市石部北一丁目１番１７号,0748-77-5577,太陽光,47.8,滋賀県湖南市石部北１－１－１７,0,47.8,1月29日2014年,2015年3月,-,-,外部積立て,-,2035年1月
A796940E25,松宮　亘,,,,太陽光,29.0,滋賀県彦根市野瀬町１７７,0,29.0,1月29日2014年,2014年6月,-,-,外部積立て,-,2034年4月
A796941E25,伊庭　嘉兵衞,,,,太陽光,40.0,滋賀県草津市新浜町字北浜１６８－１,0,47.7,1月29日2014年,2014年8月,-,-,外部積立て,-,2034年6月
A796945E25,伊庭　嘉兵衞,,,,太陽光,39.5,滋賀県草津市新浜町字北浜１６８－５,0,43.2,1月29日2014年,2014年7月,-,-,外部積立て,-,2034年5月
A797017E25,岡　永治郎,,,,太陽光,49.5,滋賀県蒲生郡日野町西大路字殿町１２４１,0,49.9,1月29日2014年,2015年5月,-,-,外部積立て,-,2035年4月
A797021E25,岡　美津代,,,,太陽光,49.5,滋賀県蒲生郡日野町西大路字殿町１２４１,0,49.9,1月29日2014年,2015年5月,-,-,外部積立て,-,2035年4月
A797023E25,岡　里華子,,,,太陽光,49.5,滋賀県蒲生郡日野町西大路字殿町１２４１,0,49.9,1月29日2014年,2015年5月,-,-,外部積立て,-,2035年4月
A797027E25,岡　宏匡,,,,太陽光,49.5,滋賀県蒲生郡日野町西大路字殿町１２４１,0,49.9,1月29日2014年,2015年5月,-,-,外部積立て,-,2035年4月
A797029E25,岡　優里,,,,太陽光,49.5,滋賀県蒲生郡日野町西大路字殿町１２４２－１,0,49.9,1月29日2014年,2015年5月,-,-,外部積立て,-,2035年4月
A797039E25,株式会社エイカー,代表取締役　小野田　一幸,草津市岡本町２２８番１,,太陽光,49.9,滋賀県草津市岡本町２２８－１,0,49.9,1月29日2014年,2014年6月,-,-,外部積立て,-,2034年4月
A797052E25,有限会社　三康,長野　るみ子,大津市月輪３－３－５,077-545-0627,太陽光,32.1,滋賀県大津市月輪３－５７－１１,0,32.1,1月29日2014年,2014年7月,-,-,外部積立て,-,2034年4月
A797056E25,福田　明男,,,,太陽光,24.8,滋賀県湖南市三雲１２６４－４,0,24.8,1月29日2014年,2014年4月,-,-,外部積立て,-,2034年2月
A797068E25,二村　正宏,,,,太陽光,44.0,滋賀県長浜市東上坂町１２１８－１,0,44.0,1月29日2014年,2014年11月,-,-,外部積立て,-,2034年10月
A797089E25,グローヴ株式会社,小本　昌宏,大阪府大阪市北区東天満二丁目９番４号,06-6809-5038,太陽光,49.7,滋賀県高島市鵜川１０６２－５,0,49.7,1月29日2014年,2014年11月,-,-,外部積立て,-,2034年9月
A797090E25,グローヴ株式会社,小本　昌宏,大阪府大阪市北区東天満二丁目９番４号,06-6809-5038,太陽光,42.0,滋賀県高島市鵜川１０６２－５,0,49.7,1月29日2014年,2014年11月,-,-,外部積立て,-,2034年9月
A797091E25,グローヴ株式会社,小本　昌宏,大阪府大阪市北区東天満二丁目９番４号,06-4798-8288,太陽光,40.0,滋賀県高島市鵜川１０６２－５,0,42.6,1月29日2014年,2014年11月,-,-,外部積立て,-,2034年9月
A797093E25,吉田　重之,,,,太陽光,40.5,滋賀県米原市大鹿５６,0,42.6,1月29日2014年,2015年4月,-,-,外部積立て,-,2035年2月
A797096E25,北村　典史,,,,太陽光,24.8,滋賀県蒲生郡日野町内池２３８－７,0,24.8,1月29日2014年,2014年4月,-,-,外部積立て,-,2034年3月
A797103E25,杉原　紀元,,,,太陽光,20.5,滋賀県蒲生郡日野町河原１－３７,0,20.5,1月29日2014年,2014年5月,-,-,外部積立て,-,2034年3月
A797181E25,ｓｕｂｌｉｍｅ不動産販売株式会社,南井　崇作,滋賀県守山市焔魔堂町２３６,077-582-3300,太陽光,49.5,滋賀県草津市野村６－１１－１２,0,49.5,1月29日2014年,2014年10月,-,-,外部積立て,-,2034年8月
A797196E25,株式会社　松吉土地,松吉　成樹,近江八幡市西本郷町西７－１,0748-38-4166,太陽光,23.2,滋賀県近江八幡市浅小井町６３６,0,24.0,1月29日2014年,2014年6月,-,-,外部積立て,-,2034年5月
A797198E25,株式会社　松吉土地,松吉　成樹,近江八幡市西本郷町西７－１,0748-38-4166,太陽光,26.0,滋賀県東近江市下中野町字下波（番地未確定）,0,26.0,1月29日2014年,2014年10月,-,-,外部積立て,-,2034年8月
A797217E25,株式会社　丸安商事,安井　肇,蒲生郡竜王町綾戸３２１,0748-57-0125,太陽光,29.7,滋賀県蒲生郡竜王町綾戸１００８－１,0,30.2,1月29日2014年,2014年6月,-,-,外部積立て,-,2034年4月
A797270E25,株式会社　橋本商店,橋本　正治,蒲生郡日野町豊田１８９,0748-52-0094,太陽光,38.5,滋賀県蒲生郡日野町中山字川原６４７,0,43.6,1月29日2014年,2015年5月,-,-,外部積立て,-,2035年4月
A797298E25,株式会社　橋本運輸倉庫,橋本　正治,蒲生郡日野町松尾３３４,0748-53-2022,太陽光,49.5,滋賀県蒲生郡日野町松尾３３４,0,56.5,1月29日2014年,2015年4月,-,-,外部積立て,-,2035年3月
A797300E25,馬場　宏之,,,,太陽光,21.2,滋賀県野洲市菖蒲２６２－１１６,0,21.2,1月29日2014年,2014年4月,-,-,外部積立て,-,2034年3月
A797345E25,甘利香辛食品株式会社,甘利　爲保,京都市伏見区新町１３丁目２９５,0749-37-3366,太陽光,49.9,滋賀県愛知郡愛荘町蚊野外金剛寺野３８２－１,0,49.9,1月29日2014年,2014年7月,-,-,外部積立て,-,2034年6月
A797348E25,有限会社　村川工務店,村川　佐太郎,愛知郡愛荘町香之庄６４５,0749-37-3255,太陽光,48.3,滋賀県愛知郡愛荘町香之庄９０７,0,48.3,1月29日2014年,2014年6月,-,-,外部積立て,-,2034年4月
A797423E25,小林建設,小林　弘幸,彦根市小泉町２６０－６,0749-26-8065,太陽光,49.5,滋賀県彦根市清崎町１２９７－３,0,49.5,1月29日2014年,2015年10月,-,-,外部積立て,-,2035年8月
A797437E25,株式会社　橋本商店,橋本　正治,蒲生郡日野町豊田１８９,0748-52-0094,太陽光,49.5,滋賀県蒲生郡日野町中山字川原６４７,0,53.0,1月29日2014年,2015年5月,-,-,外部積立て,-,2035年4月
A797438E25,株式会社　橋本商店,橋本　正治,蒲生郡日野町豊田１８９,0748-52-0094,太陽光,49.5,滋賀県蒲生郡日野町中山字川原６４７,0,55.3,1月29日2014年,2015年5月,-,-,外部積立て,-,2035年4月
A797447E25,東陽開発　株式会社,杉田　久和,東近江市林町２６６番地１,0748-42-0660,太陽光,27.5,滋賀県東近江市長勝寺町字湯屋之町１３１,0,27.5,1月29日2014年,2014年7月,-,-,外部積立て,-,2034年5月
